191NLE23R0009,Freight Forwarding Services INL Colombia,"Solicitation Notice:  191NLE23R0009 &ndash; Freight Forwarding Services INL Colombia

Updated to add responses to the questions submitted. Revised Statement of Work attached.

It is requested that all interested parties submit their proposals via e-mail to Michele Coccovizzo at coccovizzoml@state.gov and Margaret R. Gaudreau at gaudreauMR@state.gov by 5:00 pm EST, on Friday,  June 2, 2023. Solicitation has been extended to 5:00 PM EST, Wednesday, June 7, 2023 

Questions pertaining to this solicitation shall be accepted until 12:00 PM EST on Friday, May 19, 2023. Questions shall also be submitted via email to Michele Coccovizzo at coccovizzoml@state.gov and Margaret R. Gaudreau at gaudreauMR@state.gov.

Statement of Work Summary

The Contractor shall provide services for the United States Mission, Bogota, Colombia as described. This consists of freight forwarder services for the International Narcotics and Law Enforcement Affairs Section (INL), U.S. Embassy Bogota, Colombia to receive various shipments to and from Colombia and to perform import/export and shipping requirements in support of INL programs. The shipments will include but are not limited to; aircraft parts and components, hazardous materials, ammunition, vehicles, and vehicle parts, building and facilities equipment, Foreign Military Sales (FMS) cargo, and general commodities. The primary responsibility is to provide proper, timely and cost effective freight forwarding services for the following INL programs: ARAVI (Colombian National Police Air Service), CNP Interdiction (Base security, ABD, Junglas, Diran, etc.), Integrated Eradication, Rural Security (Carabineros), CD Brigade, International Cooperation Division (ICD), Rule of Law (Justice, Human Rights, and Corrections), Program Development &amp;Support (PD&amp;S), Department of Justice (DOJ), Coast Guard / Colombian NAVY, Corrections, and Drug Enforcement Administration (DEA). This list is considered representative and shall not be considered as all inclusive.

The Contractor shall furnish all managerial, administrative, direct labor personnel, materials and transportation that are necessary to accomplish all work as required by this contract. Contractor employees shall be on site only for performance of contractual duties and not for other business purposes.

In terms of geographical location, eligible companies shall have warehouse facilities to receive/store cargo in the area surrounding the Miami (FL) airport due to the following:


	The geographical distance between Colombia and Miami is a key factor for the INL Colombia operations, making the shipment expenses lower than shipping from other locations in the US. 
	Availability of several options in terms of US flag carriers for air and maritime shipments capable of moving cargo to Latin America. 
	Miami has availability of daily air and weekly maritime shipment options to move the cargo from or into the US. 
	The Miami seaport is the biggest getaway to move cargo from the US to Latin America, which makes it a strategic origin point for maritime shipments considering that the majority of the INL cargo will arrive to the Cartagena or Santa Marta seaports, both located on the Colombian Caribbean coast. 


The contractor shall establish effective service controls for the prompt and complete performance under this contract. This shall include:


	Adequate terminal facilities to effectively receive and store shipments.
	Adequate facilities to effectively service the receipt of shipments.
	Equipment deemed necessary to perform services including temperature protection for commodities requiring temperature control.
	Prompt inspection and notification of damaged cargo.
	Protection from the elements and securing of received material.
	Transportation and documentation of hazardous materials.
	Packing, freight handling, forwarding, cargo storage, customs clearance and other related services that apply to shipments originating from, consigned to, routed through, and/or moved from the United States to Colombia, from Colombia to points in the United States of Government-owned materials.


The measure of performance shall be the condition of packed articles upon arrival at their destination, accuracy of documents, and shipping according to priority status. The Contractor must appreciate the importance of U.S. Government property and always take the greatest care in handling and packing such articles. No claim for any additional compensation shall be considered unless it has been authorized by the Government in writing in advance. The Government shall not be responsible for any work performed that is not specifically provided for under the terms of this contract or authorized by the Government in writing in advance.

Packing Specifications and Responsibilities

Labor employed to perform services under this contract shall be experienced and competent in the performance of such services.


	The Contractor agrees to provide complete services for surveying, packing, crating, weighing, and marking of official Government shipments of commodities including, but not limited to, aircraft parts and components, hazardous materials, ammunition, vehicles and vehicle parts, building and facilities equipment, Foreign Military Sales (FMS) cargo, and general commodities, for shipment within and from the United States of America. Such services will be performed on goods located primarily within the United States of America (export), as requested.
	The Contractor shall provide all necessary packing and crating material required by this specification and standard industry practice for the services under this contract.
	The Contractor shall provide export packing and related services following the best commercial practices to ensure a shipment of the least tare weight and smallest cubic measurement that is compatible with assurance of transportation to destinations without damage or pilferage to containers or contents. Export packing shall include, but shall not be limited to, padding, dunnage and packing into cases, barrels, or crates of all fragile items.
	Although some shipments will be of a high priority nature and will require immediate shipment, it is most practical to consolidate the packing and shipping of items. Consolidations will not contain mixed priorities. Where there is a conflict between order priorities on the purchase order and operational requirements, INL will direct the priority of shipment.


Freight Handling

The Contractor shall act on behalf of the Government on any selected incoming and outgoing Government cargo that may be assigned to the Contractor under this contract, including the effecting of necessary transport of Government cargo from the United States of America to Colombia and vice versa. The Contractor accepts full responsibility for any and all losses and/or damage, from the time such cargo is received into the hands of the Contractor until it is released into the custody of the Government as evidenced by a signed receipt. The Contractor further agrees that in any instance involving loss or damage to the Government cargo, where the Contractor fails to exercise reasonable diligence, the Contractor shall assume full responsibility for such losses or damage including payment of claims for such losses or damage.

The Contractor shall transport all incoming Government cargo handled under the contract from the contractor&rsquo;s warehouse in the Miami (FL) area to the final destination in the Bogota area or elsewhere in Colombia, according to the order priority on the purchase order. Purchase orders for other commodities shall be marked as urgent if they require expedited shipping. Otherwise, contractor can assume the shipment is regular and should be consolidated.

Freight Forwarding and Warehousing Services

The contractor shall provide freight forwarding and warehousing services including but not limited to:


	Coordinate receipt and delivery of freight, from the individual commodity supplier&rsquo;s origin points to the contractor&rsquo;s warehouse.
	Verify, count, weight, cube and condition of all received commodities at the time of receipt and in the event of loss, damage, or shortage promptly notify INL and assist with sufficient documentation to justify a INL claim for compensation.
	Provide warehousing and storage services for commodities during the period of consolidation and while awaiting ocean/air shipment.
	Consolidate freight and stuff export containers.
	Secure air freight from an American Flag Air Carrier utilizing the most economical rate available. All Ocean freight must be pre-approved by INL in advance of booking.
	The contractor shall utilize air freight when air freight is most economical. Ocean freight shall be utilized for oversized or extremely heavy shipments. Ocean freight will not be used often due to the limited transportation capacity within Colombia and the safety and travel requirements to clear freight at Port.  The contractor shall confirm with INL Bogota the method of shipment if doubt exists as to whether it will be air freight or ocean freight.
	For import shipments the contractor shall make the necessary arrangements for clearing the freight through U.S. Customs and shipping the freight to a supplier as designated by INL Bogota.


Shipping (and/or Packing) of cargo intended for the International Narcotics and Law Enforcement transportation is a highly specialized function. The measure of performance shall be the condition of packed articles upon arrival at their destination, accuracy of documents, and shipping according to priority status. The Government shall not be responsible for any work performed which is not specifically provided for under the terms of this contract or authorized by the Government in writing in advance.

Contractor Responsibilities

Administration:

The Contractor shall be responsible for the effective management and administration of all required work under this contract. The Contractor shall be responsible for ensuring that all work activities are performed in a timely and cost-effective manner while maintaining the highest quality of performance. The prices established in Section B of the contract include all costs associated with this task.

The contractor shall furnish all managerial, administrative, direct labor personnel, materials and transportation that are necessary to accomplish all work as required by this contract.

Performance Reporting:

The Contractor shall develop and deliver timely, complete and accurate monthly Performance Reports to the Contracting Officer&rsquo;s Representative (COR) not later than the fifth (5th) business day after the reporting performance period. The report shall include but not be limited to the following:


	Work performed during the reporting period including accomplishments, real and anticipated problems/issues and recommendations for corrections;
	Work to be accomplished during the next reporting period;
	Immediate actions required of the Government for the continued on-time and on-cost performance of the contract;
	Ad hoc information on project status on an as-needed basis and as directed by the COR; and
	Lessons learned to date, with performance improvement recommendations.


Damage Loss Report:

The Contractor shall, in case of damages and losses; report to the Contracting Officer&rsquo;s Representative (COR) not later than the first business day after the occurrence. In case of loss, damage or delay to a shipment(s) such as theft or seizure of cargo, strikes, embargoes, fires or other similar incidents, the contractor shall notify in writing no later than the first working day to the COR after such incident.

Work Skills and Experience

The Contractor shall ensure that all personnel assigned to this contract possess the skills and experience necessary for accomplishing their individual tasks.

The contractor shall provide freight forwarding and customs brokerage services in accordance with the Department of Transportation and/or International Airlines Transportation regulations for the freight handling, forwarding, customs clearance and other related services that apply to shipments originating from, consigned to, routed through and/or moved from/to the United States to/from Colombia, or other locations when required.

The contractor shall provide Airway Bills, invoices, packing lists, purchase orders or other documentation prepared during the export/import process to INL Bogota.

The contractor shall maintain a web-based database for all shipments. The database will be capable of providing details of line items received and line items shipped, as well as being suitable for preparation of all required shipping documentation. The intent is to be able to provide, per purchase order line-item real time tracking and cost data from time of receipt to time of shipment, by priority. The contractor will provide a description of this web-based tracking/database as part of the proposal.

For exporting transactions/shipments the contractor shall make the necessary arrangements for shipping the freight from the contractor&rsquo;s warehouse to Port of Importation, Colombia, South America, according to the order priority on the purchase order. Aircraft Purchase orders will indicate the following priorities: AOG - Aircraft on Ground, immediate shipment; 05 urgent; 12 regular - not a priority. Purchase orders for other commodities will be marked as urgent if they require expedited shipping. Otherwise, contractor can assume the shipment is regular and should be consolidated.

Upon contract award, the contractor shall be notified as to how to mark the shipments for the appropriate programs. All documentation will indicate that the exporter/importer of record is the U.S. Department of State.

Record Keeping Requirements

The Contractor shall prepare a complete, accurate and legible Inventory List as the articles are packed. The original will be retained by the Contractor and shall be forwarded to the COR immediately after the packing is completed. All exceptions as to the condition of goods listed on the Inventory List must be brought to the COR&rsquo;s attention before goods are removed from the contractor facilities.

The purchase order number and the project&acute;s name shall appear on each sheet of the Inventory List, and the last sheet must also indicate the total number of boxes, total number of shipping crates (lift vans), net, tare and gross weights, with measurements and total cubic measure.

Storage Area Requirements

All temporary or permanent storage provided, either for unpacked or packed aircraft parts and components, hazardous materials, ammunition, vehicles and vehicle parts, building and facilities equipment, Foreign Military Sales (FMS) cargo, and general commodities, shall be inside storage buildings and areas that are acceptable to and approved by the COR.

In areas assigned for preparation and storage of aircraft parts and components, hazardous materials, ammunition, vehicles and vehicle parts, building and facilities equipment, Foreign Military Sales (FMS) cargo, and general commodities the Contractor shall prevent pilferage or damage by sunlight, water, or fire. Government owned materials shall be stored in areas that are dry, well ventilated, clean, and free from dust, insects and rodents, have adequate fire protection, and are accessible for routine inspection.

The Contractor shall keep aisles, driveways, and entrances free of storage and equipment not being currently handled or operated.

The Contractor shall remove waste or refuse from storage areas or kept in metal containers with tight-fitting metal lids.

Government owned materials shall be stored on skids, dunnage, pallet bases, elevated platforms, or similar storage aids, maintaining a minimum of two inches of clearance from the floor to the bottom-most portion of the stored goods. The Contractor shall not store property in contact with exterior or interior walls.

Requirements for Storage Methods

The Contractor shall place aircraft parts and components, hazardous materials, ammunition, vehicles and vehicle parts, building and facilities equipment, Foreign Military Sales (FMS) cargo, and general commodities into temporary or permanent storage inside a warehouse on the day of receipt or, in the event of inclement weather, immediately upon receipt.

The Contractor shall establish and maintain a locator system to enable prompt identification and removal of effects in storage.

Warehouse Facilities

Warehouse Facilities must be approved by the COR and meet the following criteria:


	Storage buildings shall be constructed, with masonry walls and floors, watertight roofs, and maintained in good condition. The building shall be kept dry, clean, well ventilated, free of dampness, free of moths, rats, mice, and insets, and in orderly condition at all times.



	Each building used for storage under this contract shall have as the minimum standard for qualification either:



	an acceptable automatic fire detection and reporting system, or an acceptable automatic sprinkler system; or



	a fire prevention and control plan, posted and maintained in each building; and necessary fire extinguishers and/or approved fire-fighting apparatus available and in good working order at all times.


In addition, each storage facility must be protected by an adequate water supply for fire fighting and a fire department that is responsive twenty-four hours per day. Statements from the cognizant fire insurance rating organization shall be used by the Government as a definitive basis for determining the sufficiency or adequacy of a fire-fighting water supply and the responsiveness of a fire department to protect a facility.


	The Contractor shall insure that all installed fire protective systems shall be accredited by the cognizant fire insurance rating organization for insurance rate credit.


Notification of Completion of Services:

As soon as the required services for outgoing cargo shipments are completed, the Contractor shall notify the COR and provide the following information:


	If a shipment of government owned property: Purchase order number and INL program requesting the shipment.
	Ultimate destination of shipment
	Date of pickup, number of pieces and gross weight of shipment.
	Bill of Lading or Airbill number assigned to the shipment.


The Contractor shall obtain a proper receipt from the carrier or its agent at the time the cargo is delivered to the carrier by the Contractor.

Vehicles

The Contractor shall provide all vehicles necessary for the performance of this contract. All vehicles shall be kept in safe operating condition at all times with a valid safety inspection sticker attached if required by local law. The Contractor shall provide all fuel and lubricants for the vehicles.

Vehicle Size. The Contractor shall provide the necessary vehicles of appropriate size (2.5 tons or more) for local transportation of shipments.

Condition of Vehicles. The Contractor shall maintain its vehicles in the proper mechanical condition to assure their full availability when needed, and to assure that shipments are reliably and safely transported from the residence to the appropriate staging area.

Non-Availability of Vehicles. Should the Contractor encounter mechanical difficulties that would otherwise prevent the scheduled completion of a scheduled pick-up or delivery, the contractor shall immediately obtain a suitable substitute vehicle at no additional cost to the Government. Non-availability of suitable vehicles shall not constitute acceptable justification for late pickup or delivery, or for additional costs to the Government.

Computation of Weight

Gross Weight is calculated by adding the Net Weight of the contents to the weight of the shipping container and any bracing material used to secure articles in the container.

The Contractor shall designate, and the COR shall approve a scale to be used for determination of shipment weights. Subject scale must be officially certified by any entity approved by the National Institute of Standards and Technology (NIST) as accurate and must continually display documentation in testimony thereof. All official certificates of accuracy must be periodically updated and recertified to ensure there is no lapse of certification.

Transition/Phase-In and Phase-Out Services

The Contractor shall assume all pending requests not completed by the incumbent contractor. Open orders not received by the incumbent five days prior to the end of its period of performance shall be transferred to the incoming contractor that shall be responsible for:  storage, oversight for completion of work, all pending payments, warranties, and shipping to Bogota. Task order(s) for this work shall be priced in accordance with the pricing shown in Section 1; however, if a task order&rsquo;s requirements differ from the items priced in Section 1, it shall be accomplished in accordance with the task order process described below.

Phase-out services at the end of this contract shall be handled in accordance with FAR 52.237-3.

Primary Point of Contact: 

Michele Coccovizzo
Senior Contract Support Specialist
CoccovizzoML@state.gov

Secondary Point of Contact:

Margaret R. Gaudreau
Contracting Officer
GaudreauMR@state.gov




",DOS Office of Acquisition Management,2023-06-02 13:50:57.168000+00:00,6/2/2023,2023-06-07 21:00:00+00:00,6/7/2023,America/New_York,Solicitation,8A,488510,Freight Transportation Arrangement ,V119,Other Cargo and Freight Services,,Michele Coccovizzo,coccovizzoML@state.gov,,,,"Gaudreau, Margaret R",GaudreauMR@state.gov,,,,,Miami,FL,,USA,UNITED STATES,,,,,,,,,,,1900,191NLE,ACQUISITIONS - INL,3c9afd2c721945f0b6ac2803722ce0cf,gaudreaumr@state.gov,coccovizzoml@state.gov,2023-09-01 03:55:41.271000+00:00,2023-06-02 13:06:27.749000+00:00,https://sam.gov/opp/a14efb72789e46cf9fa332e06736adf4/view
