W5J9JE-11-S-EXPSERV,R--Material and Equipment Expediter Services,"This is NOT a solicitation for proposals, proposal abstracts, or quotations.  The purpose of this notice is to obtain information regarding:  (1) the availability and capability of qualified business sources; (2) Business capability to satisfactorily perform the requirements at a high degree of satisfaction.  (3) Your responses to the information requested will assist the Government in determining the appropriate acquisition method.Requirements:Major tasks requirements for service providers include the following:1) Coordination with Pakistan's consulates2) Coordination with Pakistani customs officials3) Coordination with Afghani customs officials at the Pakistani Border4) Tracking of designated materials and equipment at designated locations in Pakistan (including, but not limited to, Karachi and border crossing points with Afghanistan)5) Reporting of status of equipment and materials to United States Army Corps of Engineers Afghanistan Engineering District-North Anticipated Period of Performance:  The anticipated period of performance is 1 October 2011 with one (1), one (1) year award term option period.Capability Statement/Information Sought:Interested qualified business organizations should submit a tailored capability statement for this requirement, not to exceed 5 single-sided pages (including all attachments, past experience with the U.S. Government , performance on prior/current identical requirements, etc.), presented in single-space and using a 12-point font size minimum, that clearly details the ability to perform the aspects of the notice described above.  The capability statement should be separated into the following sections; (1) Business Capability, (2) Personnel Capability, (3) Past Experience, (4) Past Performance. Information Submission Instructions:All submission information sent in response to this SOURCES SOUGHT notice must be submitted electronically (via email) to Daniel.n.Portillo@usace.army.mil and patti.j.rivera@usace.army.mil in MS Word, or Adobe Portable Document Format (PDF) by 03:00 P.M. 14 June 2011 Afghanistan time.Disclaimer and Important Notes:This notice does not obligate the Government to award a contract or otherwise pay for the information provided in the response. The Government reserves the right to use information provided by respondents for any purpose deemed necessary and legally appropriate. Any organization responding to this notice should ensure that its response iscomplete and sufficiently detailed to allow the Government to determine the organization's qualifications to perform the work. Respondents are advised that the Government is under no obligation to acknowledge receipt of the information received or provide feedback to respondents with respect to any information submitted. After a review of the responses received, a pre-solicitation synopsis and solicitation may be published in Federal Business Opportunities. Respondents will be added to theprospective offerors list for any subsequent solicitation. However, responses to this notice will not be considered adequate responses to a solicitation.Confidentiality:No proprietary, classified, confidential, or sensitive information should be included in your response. The Government reserves the right to use any non-proprietary information in any resultant solicitation(s).",USACE Middle East District,2011-05-26 18:32:18+00:00,5/26/2011,2011-06-14 05:00:00+00:00,6/14/2011,,Sources Sought,,488510,Freight Transportation Arrangement ,R,"Support Services (Prof, Admin, Mgmt)",,"Daniel Portillo, 540-723-4862

<a href=""mailto:daniel.n.portillo@usace.army.mil"">USACE Middle East District</a>",,,,,,daniel.n.portillo@usace.army.mil,,,,,,,,,,,,,,,,,,,,,,USACE Middle East District,d282b5e558eb0fbe38815af1f1062ead,PI33_DR_IAE_51681,noreply@fbo.gov,2011-08-13 13:15:38+00:00,2011-05-26 18:32:18+00:00,https://sam.gov/opp/d282b5e558eb0fbe38815af1f1062ead/view
FA5587-11-R-0006,FMO Haulage and Repair Services,"This announcement serves as notice to all potential offerors that the 48th Fighter Wing Contracting Squadron (48CONS), Building 977, RAF Lakenheath, United Kingdom anticipates publicizing a formal Request for Proposal (RFP) under solicitation number FA5587-11-R-0006 for Furnishings Management Office (FMO) Appliance/Furniture Haulage and Repair services. The NAICS Code for this solicitation is 488510 - Freight Transportation Arrangement.48CONS is advertising its' intent to post the RFP on 16 June 2011 for a requirement for the delivery, installation, disconnection, and pick-up of domestic household furniture and appliances to and from government designated residences, dormitories, lodging facilities, and fire stations in support of the FMO at RAF Feltwell, United Kingdom. The contractor shall provide the following services at RAF's Lakenheath, Mildenhall, Feltwell, and its' surrounding residential areas. The duration of this contract is prescribed as a four year, eleven month ordering period from 01 Nov 2011 to 30 Sep 2016, and will be issued under full and open competition procedures with an anticipated award date of 01 Oct 2011. The Government points of contact are Mr. Richard Enriquez, richard.enriquez@lakenheath.af.mil and Mr. Steven Quillin, steven.quillin@lakenheath.af.mil. The formal announcement of the RFP will provide all applicable documents for this requirement. ",U.S. Air Forces Europe and Africa,2011-05-10 15:42:17+00:00,5/10/2011,,,,Presolicitation,,488510,Freight Transportation Arrangement ,V,"Transport, Travel, Relocation",,Richard E. Enriquez,richard.enriquez@lakenheath.af.mil,4.40164E+12,,Alternate POC,Steven F. Quillin,steven.quillin@lakenheath.af.mil,011-44-(0)1638-52-2393,011-44-(0)1638-52-2189,"RAF Lakenheath, RAF Mildenhall, RAF Feltwell and sorrounding residential areas",,,,,GBR,,,,,,,,,,,,,,48 CONS/LGC - Lakenheath,98194523f9de20c7b4c48f023f1edf8b,PI33_DR_IAE_51681,,2011-11-16 09:39:25+00:00,2011-05-10 15:42:17+00:00,https://sam.gov/opp/98194523f9de20c7b4c48f023f1edf8b/view
AG-INTS-S-11-0001,Freight Forwarding Services for Foodstuffs to Various Points in Alaska,,Kansas City Commodity Office,2010-12-10 22:49:50+00:00,12/10/2010,2010-12-22 18:00:00+00:00,12/22/2010,,Synopsis Solicitation,,488510,Freight Transportation Arrangement ,V,"Transport, Travel, Relocation",Contract Specialist,Ron Reynolds,ronald.reynolds@kcc.usda.gov,816-926-6375,,Contracting Officer,Dan Webber,dan.webber@kcc.usda.gov,816-926-2847,,At Seattle/Tacoma and various locations in Alaska,,SEATTLE,WA,,USA,,,,,,,,,,,,,,Kansas City Commodity Office,cd155627f2c11bc47b542c8ecdb7d461,PI33_DR_IAE_51681,,2011-01-26 16:22:16+00:00,2010-12-10 22:43:41+00:00,https://sam.gov/opp/b887c3adeb092009f16afb41eee26c33/view
10R0004,Freight Forwarding - Japan,"This is notification that an award will be made in accordance with 10 USC 2304 (c)(1), Justification for Other than Full and Open Competition, to Raymond Express International, 320 Harbor Way, San Francisco, CA, 94080, as a bridge contract in order to continue freight forwarding services for military customers in Japan. The proposed period of performance is 01 October 2010 through 30 September 2011. The J&amp;A will be posted at time of award.",DLA Troop Support - Indo-Pacific Region,2010-09-08 01:35:36+00:00,9/8/2010,,,,Presolicitation,,488510,Freight Transportation Arrangement ,89,Subsistence,Contract Specialist,Scott Estes,Scott.Estes@dla.mil,1.18232E+12,1.18232E+12,Contract Specialist,Steve Choe,sunghak.choe.kor@dla.mil,1.18232E+12,,,,,,,,,,,,,,,,,,,,,DLA Troop Support Indo Pacific,ccf86ed85b3775d89c52e794a46a9ea8,PI33_DR_IAE_51681,Scott.1.Estes@dla.mil,2019-06-29 08:40:52+00:00,2010-09-08 01:35:36+00:00,https://sam.gov/opp/35a5797c8b0254c634e0a3a7850f4d2c/view
10R0005,Freight Forwarding - Korea,"This is notification that an award will be made in accordance with 10 USC 2304 (c)(1), Justification for Other than Full and Open Competition, to Raymond Express International, 320 Harbor Way, San Francisco, CA, 94080, as a bridge contract in order to continue freight forwarding services for military customers in Korea. The proposed period of performance is 01 October 2010 through 30 September 2011. The J&amp;A will be posted at time of award.",DLA Troop Support - Indo-Pacific Region,2010-09-08 01:28:46+00:00,9/8/2010,,,,Presolicitation,,488510,Freight Transportation Arrangement ,89,Subsistence,Contract Specialist,Scott Estes,Scott.Estes@dla.mil,1.18232E+12,1.18232E+12,Contract Specialist,Steve Choe,sunghak.choe.kor@dla.mil,1.18132E+12,,,,,,,,,,,,,,,,,,,,,DLA Troop Support Indo Pacific,da6c561f4198da97037f8040ed161b0b,PI33_DR_IAE_51681,Scott.1.Estes@dla.mil,2019-06-29 08:40:53+00:00,2010-09-08 01:28:46+00:00,https://sam.gov/opp/da6c561f4198da97037f8040ed161b0b/view
SPM302-10-R-0004,Freight Forwarding Services - Japan,"This is notification that an award will be made in accordance with 10 USC 2304 (c)(1), Justification for Other than Full and Open Competition, to Raymond Express International,320 Harbor Way, San Francisco, CA, 94080, as a bridge contract in order to continue freight forwarding services for military customers in Japan. The proposed period of performance is 01 October 2010 through 30 September 2011. The J&amp;A will be posted at time of award.  See Note 22.  All interested offerors may submit an offer which will be considered.",DLA Troop Support - Indo-Pacific Region,2010-09-08 00:59:28+00:00,9/8/2010,2010-09-14 14:00:00+00:00,9/14/2010,,Presolicitation,,488510,Freight Transportation Arrangement ,89,Subsistence,Contract Specialist,Scott Estes,Scott.Estes@dla.mil,1.18232E+12,1.18232E+12,Contract Specialist,Steve Choe,sunghak.choe.kor@dla.mil,1.18232E+12,,Japan,,,,,JPN,,,,,,,,,,,,,,DLA Troop Support Indo Pacific,ab8b4017a430225413684151ff073bf0,PI33_DR_IAE_51681,Scott.1.Estes@dla.mil,2010-09-29 09:21:42+00:00,2010-09-08 00:59:28+00:00,https://sam.gov/opp/2630b6be5a4d1be865d2e7cac01180bd/view
FA5209-10-T-0235,Customs Clearance and Transportation of Freight,,Pacific Air Forces,2010-08-26 07:38:09+00:00,8/26/2010,,,,Sources Sought,,488510,Freight Transportation Arrangement ,V,"Transport, Travel, Relocation",Contract Specialist,Atsutaro Yamada,atsutaro.yamada.jp@yokota.af.mil,81-42-552-3010,81-42-552-9846,Contracting Officer,Maki Kodama,maki.kodama.jp@yokota.af.mil,81-42-552-3010,81-42-552-9846,Japan,,,,,JPN,,,,,,,,,,,,5700,FA5209,FA5209  374 CONS PK,219ddcd5b1418ee811fd0f57e25ac208,PI33_DR_IAE_51681,,2010-10-12 09:02:38+00:00,2010-08-26 07:38:09+00:00,https://sam.gov/opp/04404de03840ec4484a1f4e4eb3c3e65/view
FA5587-10-R-0008,"FMO haulage, repair, and maintenance sources sought","This is a Pre-solicitation Notice only and is issued for the purpose of market research. The 48th Contracting Squadron at RAF Lakenheath, United Kingdom anticipates the establishment of an indefinite delivery indefinite quantity (IDIQ) contract for haulage, repair, maintenance and delivery service. The performance period will be for one base year with four, one-year option years. The anticipated contract start date is 1 June 2011. This requirement will be solicited as Full and Open Competition and will not contain set-asides. The applicable NAICS Code for this solicitation is 488510. Award of a contract from the forthcoming solicitation will be made on the basis of best value procedures IAW FAR Part 15.101 using a tradeoff process to evaluate factors of Price, Technical, and Past Performance. The Government reserves the right to award a contract to other than the lowest price offeror if non-price factors such as Technical and Past Performance represent the best value. All relevant solicitation documents including the Performance Work Statement will be made available for download exclusively from the internet by accessing the FedBizOps website at http://www.fbo.gov. Paper copies will NOT be available. Once the solicitation is posted, it is incumbent upon the interested parties to review this site frequently for any updates/amendments to any and all documents; and verifying the number of amendments issued prior to the due date for proposals. All potential sources must obtain a DUNS number and register in the Central Contractor Register (CCR), at http://www.ccr.gov, in order to transact business with the Department of Defense (DOD). Failure to obtain a DUNS number and register in the CCR may result in the delay of award of a contract or possible award to the next otherwise successful offeror who is registered in the CCR at the time of the award. This notice does not obligate the Government to award a contract nor does it obligate the Government to pay for any bid/proposal preparation cost. The Government reserves the right to cancel the solicitation either before or after the solicitation closing date.Interested contractors should send their contact information (company name, email, phone number) to the following point of contact: richard.enriquez@lakenheath.af.mil. ",U.S. Air Forces Europe and Africa,2010-06-29 13:39:52+00:00,6/29/2010,2010-07-28 23:00:00+00:00,7/28/2010,,Presolicitation,,488510,Freight Transportation Arrangement ,V,"Transport, Travel, Relocation",,Richard E. Enriquez,richard.enriquez@lakenheath.af.mil,4.40164E+12,,,,,,,RAF Feltwell,,,,,GBR,,,,,,,,,,,,,,48 CONS/LGC - Lakenheath,c4c4df2b7b25dbefb11c7465408f68ce,PI33_DR_IAE_51681,,2010-08-12 08:42:46+00:00,2010-06-29 13:39:52+00:00,https://sam.gov/opp/fb1c1ffc6d2f54800258df35a87e23ba/view
AG-0116-S-10-0055,Hoonah Tractor Barge Service,Hoonah Tractor Barge Service,Forest Service,2010-04-29 17:10:52+00:00,4/29/2010,,,,Sources Sought,SBA,488510,Freight Transportation Arrangement ,V,"Transport, Travel, Relocation",,Louise Jackson,louisejackson@fs.fed.us,9077725819,9077725894,,,,,,,,Hoonah,,,,,,,,,,,,,,,12C2,109,"Alaska Regional Office, R10",cdd30d235e91d57b0a174c16349ce80f,PI33_DR_IAE_51681,louisejackson@fs.fed.us,2010-08-10 19:39:31+00:00,2010-04-28 22:55:53+00:00,https://sam.gov/opp/cdd30d235e91d57b0a174c16349ce80f/view
W52P1J-10-R-0134,V--Posting of redacted J&A,Contract award for line haul movement of cargo from Uzbekistan to Afghanistan.  Redacted J&A attached,Joint Munitions Command,2010-04-14 14:42:52+00:00,4/14/2010,,,,Special Notice,,488510,Freight Transportation Arrangement ,V,"Transport, Travel, Relocation",,"Mitzi Wagner, 309-782-4657

<a href=""mailto:mitzi.wagner@us.army.mil"">Rock Island Contracting Center (RI-CC)</a>",,,,,,mitzi.wagner@us.army.mil,,,,,,,,UZB,,,,,,,,,,,,2100,W52P1J,W4MM USA JOINT MUNITIONS CMD,f4dc8d8ce0ac42ff9aa6bfd0f1d4e75c,PI33_DR_IAE_51681,noreply@fbo.gov,2010-07-13 08:38:18+00:00,2010-04-14 14:42:52+00:00,https://sam.gov/opp/f4dc8d8ce0ac42ff9aa6bfd0f1d4e75c/view
F3QTAK0074A001,Charter Bus Transportation,"This is a combined synopsis/solicitation for commercial items prepared IAW the format in FAR subpart 12.6 as supplemented with additional information included in this notice. This announcement constitutes the only solicitation. Quotes are being requested, and a separate written solicitation will not be issued.
THIS SOLICITATION WILL NOT RESULT IN AN ORDER AGAINST AN FEDERAL SUPPLY SCHEDULE. ANY OFFER WHICH IS PREDICATED UPON THE AWARD BEING PLACED AGAINST AN FSS WILL NOT BE CONSIDERED.
The purchase of Charter Bus Transportation (Statement of Work attatched).
This is a 100% small business set-aside.
NAICS Code: 488510. Price(s) should be FOB Destination (Robins AFB GA 31098). In addition to price and delivery, quote should include your cage code, DUNS number, and taxpayer ID number.
Quotations should be emailed to Amber McCulloch (Amber.McCulloch@robins.af.mil) no later than 16 April 10, 4:00 pm EST. Please do not request award status prior to this date.
The following clauses are applicable to subject solicitation (current through FAC 2005-39 dated 19 Mar 10 and DFARS Change Notice 20100408):FAR 52.212-1 Instructions to OfferorsFAR 52.212-2 Evaluation-Commercial Items FAR 52.212-3 Offeror Representations and Certifications - Commercial Items (Rev'd Aug 09) (Added: (n) Prohibition on Contracting with Inverted Domestic Corporations.)FAR 52.212-4 Contract Terms and Conditions - Commercial ItemsFAR 52-212-5 Contract Terms and Conditions Required to Implement Statutes or Executive Orders - Commercial Items, and DFARS 252.212-7000FAR 52.247-34 FOB DestinationDFARS 252.211-7003 Item Identification and Valuation (Appl if unit price exceeds $5K.)DFARS 252.232.7003 Electronic Submission of Payment Requests (WAWF is the method used by DoD for processing invoices/receiving reports.)
In accordance with Clause 52.212-2, the evaluation factors shall be price and price related factors.
See FAR 52.212-3 (Revised Jul 09): By submission of its offer, the offeror represents that it is not an inverted domestic corporation and is not a subsidiary of one.
IAW FAR 52.212-3, Reps/Certs should be completed on-line at www.bpn.gov. Oral procedures will be used for this solicitation.",AFLCMC Robins AFB,2010-04-13 16:30:20+00:00,4/13/2010,2010-04-16 21:00:00+00:00,4/16/2010,,Synopsis Solicitation,SBA,488510,Freight Transportation Arrangement ,V,"Transport, Travel, Relocation",,Amber C. McCulloch,amber.mcculloch@robins.af.mil,4789541042,,,,,,,See Attached SOW,,Robins AFB,GA,31098,USA,,,,,,,,,,,,,,PK/PZ - Robins AFB,ac2b404865338a1d14974fe9d2d16a33,PI33_DR_IAE_51681,amber.bryant@gsa.gov,2010-05-01 08:43:14+00:00,2010-04-13 16:30:20+00:00,https://sam.gov/opp/ac2b404865338a1d14974fe9d2d16a33/view
AG-0116-S-10-0036,"Delivery of fuel, materials and supplies from Petersburg Alaska to Rowan Bay Alaska and return",See Attached Solicitation,Forest Service,2010-03-26 16:33:38+00:00,3/26/2010,2010-04-06 02:30:00+00:00,4/5/2010,,Sources Sought,SBA,488510,Freight Transportation Arrangement ,V,"Transport, Travel, Relocation",Purchasing Agent,Louise Jackson,louisejackson@fs.fed.us,9077725819,9077725894,,,,,,Petersburg Ranger District ,,PETERSBURG,AK,99833,USA,,,,,,,,,,,,12C2,109,"Alaska Regional Office, R10",da7ca6139460ef29929a3a36f27e04e0,PI33_DR_IAE_51681,louisejackson@fs.fed.us,2010-08-10 19:38:43+00:00,2010-03-25 23:03:58+00:00,https://sam.gov/opp/da7ca6139460ef29929a3a36f27e04e0/view
DPM_Volume_42_Tender_Solicitation,DPM Point to Point International Air Transportation of Personal Property - Crated Household Goods (HHG) and Unaccompanied Baggage (UB) Shipments  ,"The purpose of the tender solicitation is to obtain international air freight transportation rates for the Military Surface Deployment and Distribution Command (SDDC) Direct Procurement Method (DPM) Volume 42 cycle effective 01 Apr 10 through 31 Mar 11. 

In order to file rates, offerors must be listed on SDDC’s Freight Carrier Registration Program (FCRP) Approved Air Freight Carriers List, URL: https://mustang.eta.sddc.army.mil/ccp/Ccp. 

This program provides for the air transportation  of crated household goods (HHG) and unaccompanied baggage (UB) shipments between designated rate areas listed in the DPM International Commercial Air Program, including intertheater and intratheater (international and certain US) shipments. ",United States Transportation Command,2010-02-08 18:18:09+00:00,2/8/2010,2010-02-27 04:59:00+00:00,2/26/2010,,Synopsis Solicitation,,488510,Freight Transportation Arrangement ,V,"Transport, Travel, Relocation",Contract Specialist,John  R Wright,john.wright@ustranscom.mil,618-229-2474,618-256-2804,Contracting Officer,Gregory V Hunt,gregory.hunt@ustranscom.mil,618-229-2462,618-256-8316,Worldwide ,,,,,USA,,,,,,,,,,,,9776,HTC711,USTRANSCOM-AQ,51b2e07459bdb680016b7160f4c5fcfc,PI33_DR_IAE_51681,,2019-06-29 05:39:51+00:00,2010-02-08 18:12:31+00:00,https://sam.gov/opp/51b2e07459bdb680016b7160f4c5fcfc/view
W912EQ10R0007,V--Bus Transportation Services for DCAI,,USACE Memphis District,2010-01-19 14:00:03+00:00,1/19/2010,2010-01-19 05:00:00+00:00,1/19/2010,,Solicitation,,488510,Freight Transportation Arrangement ,V,"Transport, Travel, Relocation",,"Jackie Primer, 1-901-544-3340

<a href=""mailto:jackie.primer@mvm02.usace.army.mil"">US Army Corps of Engineers, Memphis District</a>",,,,,,,,,"US Army Corps of Engineers, Memphis District 167 North Main Street, Rm B202,  Memphis TN
38103-1894
US",,,,,,,,,,,,,,,,,2100,W912EQ,W07V ENDIST MEMPHIS,b677974da860d206a9d63f6086a444c8,PI33_DR_IAE_51681,noreply@fbo.gov,2010-02-16 09:37:56+00:00,2010-01-19 14:00:03+00:00,https://sam.gov/opp/d43717ccb1d867f9ddc76b8d34cb1464/view
AG95cvs100002fg,Relocation of a Nordion self-shielded irradiator HI to MA,"The USDA Agricultural Research Service in Albany, CA requires the relocation of a Nordion self-shielded irradiator Model No. Gammacell 220, Serial No. 172R located in Hawaii to our APHIS location in Massachusetts.  The movement of this irradiator requires specific licenses available from NRC.  Interested firms must be acquainted with the licensing and state and Federal regulations required before requesting a site visit if needed for the movement of the irradiator from Hawaii to Massachusetts   A visual site inspection can be arranged upon request.  Due to security considerations we are requesting that this procurement action be expedited and this is the reason why we are requesting a quick turnaround time in submitting proposals for our review.    Funds are not currently available to fund this project. Interested firms are requested to complete the SF-18 form provide all NRC licenses or the ability to obtain all licenses along with evidence of insurance to the attention of Fred Gifford as listed in this notice.  This procurement action is posted unrestricted.  Upon award CCR registration is required.  SCA wage rates apply and will be provided when they become available",Business Service Centers,2010-01-07 22:58:31+00:00,1/7/2010,2010-01-16 04:59:59+00:00,1/15/2010,,Synopsis Solicitation,,488510,Freight Transportation Arrangement ,N,Installation Of Equipment,,Frederick O. Gifford,fred.gifford@ars.usda.gov,510-559-6017,510-559-6023,,,,,,Hawii ,,HONOLULU,HI,,USA,,,,,,,,,,,,,,Western Business Service Center,b89e2ad160f6babbb2de6f1c9d46b7c5,PI33_DR_IAE_51681,fred.gifford@ars.usda.gov,2010-02-10 09:41:18+00:00,2010-01-07 22:58:31+00:00,https://sam.gov/opp/b89e2ad160f6babbb2de6f1c9d46b7c5/view
SPM30209R0006,FREIGHT FORWARDING SERVICES FOR JAPAN,"January 6, 2010:  For this acquisition, the small business size standard of $25.5M for NAICS 488510 - Freight Transportation Arrangement (Non-Vessel Owning Common Carriers) shall be used, instead of $7.0M as previously stated in this Notice.",DLA Troop Support - Indo-Pacific Region,2010-01-06 18:02:17+00:00,1/6/2010,2010-01-11 18:00:00+00:00,1/11/2010,,Sources Sought,,488510,Freight Transportation Arrangement ,V,"Transport, Travel, Relocation",Contracting Officer,Patricia Y. Murakami,Patricia.Murakami@dla.mil,(808) 474-2967,(808) 471-2983,Procurement Technician,Betty Geronimo,Betty.Geronimo@dla.mil,808-474-2983,808- 471-2983,Japan,,,,,JPN,,,,,,,,,,,,,,DLA Troop Support Indo Pacific,1d36661448a5fe983e965f81a6e6b895,PI33_DR_IAE_51681,,2019-06-26 03:42:25+00:00,2010-01-06 18:02:17+00:00,https://sam.gov/opp/9e9c4b759e7cb6d23665eaddae794fee/view
W91ZLK10T0059,V--DoD International Shipping of Exhibits/Equipment,,ACC Aberdeen Proving Ground,2009-12-18 22:00:11+00:00,12/18/2009,2009-12-21 05:00:00+00:00,12/21/2009,,Solicitation,,488510,Freight Transportation Arrangement ,V,"Transport, Travel, Relocation",,"KSVALENTINE, 410-278-0712

<a href=""mailto:kathy.valentine@us.army.mil"">RDECOM Contracting Center, Aberdeen Installation Contracting (RDECOM-CC)</a>",,,,,,,,,"RDECOM Contracting Center, Aberdeen Installation Contracting (RDECOM-CC) Directorate of Contracting, 4118 Susquehanna Avenue Aberdeen Proving Ground MD
21005-3013
US",,,,,,,,,,,,,,,,,2100,W91ZLK,W6QK ACC-APG DIR,96757e3d6ae399e7fadc75f79c4546e3,PI33_DR_IAE_51681,noreply@fbo.gov,2010-02-13 09:36:36+00:00,2009-12-18 22:00:11+00:00,https://sam.gov/opp/b9259a6569ee665a6c2e1f3820bd2a9c/view
LCLSB10R0003,Shipping of Donations to the Library of Congress,"The purpose of this amendment is to extend the due date for proposals to 3PM EST on Wednesday, December 16, 2009 to allow the offerors sufficient time to incorporate changes previously made to Section M.3.4.3.  No further time extension will be allowed. No further questions will be accepted. 
In order to expedite the evaluation process, offerors electing to use commercial carriers are encouraged to also make electronic submissions.
Offerors who have submitted their proposals prior to 12/09/09 may submit revised Section M.3.4.3 electronically. 
",Library of Congress,2009-12-09 16:54:11+00:00,12/9/2009,2009-12-16 22:00:00+00:00,12/16/2009,,Synopsis Solicitation,,488510,Freight Transportation Arrangement ,99,Miscellaneous,Contract Specialist,Lyudmila Bond,lbond@loc.gov,202-707-3420,202-707-8611,Sr. Contract Specialist,Keith Smiley,ksmil@loc.gov,202-707-0468,202-707-8611,"The Library of Congress
John Adams Bldg., Room LA-325
101 Independence Avenue, SE

",,WASHINGTON,DC,20540-9414,USA,,,,,,,,,,,,300,030ADV,CONTRACTS SERVICES,d178b04065252c47a5d21c58f9a744bf,PI33_DR_IAE_51681,,2019-06-29 04:37:18+00:00,2009-12-09 16:54:11+00:00,https://sam.gov/opp/e1a7e12a27cc79d05c891a3a68e08116/view
