Notice ID,Solicitation ID,Solicitation Title,Description Text,Agency Name,Posted Timestamp,Posted Date,Response Timestamp,Response Deadline,Response Timezone,Opportunity Type,Set Aside Code,NAICS,NAICS Title,PSC,PSC Description,Primary Contact Title,Primary Contact Name,Primary Contact Email,Primary Contact Phone,Primary Contact Fax,Secondary Contact Title,Secondary Contact Name,Secondary Contact Email,Secondary Contact Phone,Secondary Contact Fax,Place of Performance Street Address,Place of Performance Street Address2,Place of Performance City,Place of Performance State,Place of Performance Zip,Place of Performance Country Code,Place of Performance Country,Related Opportunity Id,Award Date,Award Amount,Award Number,Delivery Order Number,Award Justification,Awardee Name,Awardee UEI,Awardee CAGE Code,Awardee Line Item,FPDS Code,FPDS Org ID,SAM Organization Name,Parent Opportunity ID,Modified By,Created By,Modified Timestamp,Created Timestamp,Site Page,Source Website
28332dfbe76c90828e3b962ec4165b47,W91ZLK-18-Q-0007,Boeing 787 Panels,"This is a NOTICE OF INTENT TO AWARD A SOLE SOURCE CONTRACT. The Army Contracting Command, Tenant Contracting Division, 6565 Surveillance Loop, Aberdeen Proving Ground intends to issue a sole source, Firm-Fixed Price contract, under Federal Acquisition Regulation (FAR) 8.405-6(a)(i)(B) Only one source is capable of providing the supplies or services required to VAS Aero Systems, LLC., 645 Park of Commerce Way, Boca Raton, FL 33487. NAICS Code is 336411, Business Size Standard Size is 1,500. The following items will be procured: AVL KMA Mobile (High Flow Capacity) that includes:CLIN 0001 - Boeing 787 Fuselage Panel in window-door-window configurationCLIN 0002 - Boeing 787 Fuselage Panel in window-window-window configurationCLIN 0003 - Shipping The U.S. Army Test Center (ATC) requires the above fuselage panels to be used in destructive testing in accordance with IAA HSHQPM-17-X-00007 with Department of Homeland Security (DHS). These parts of the Boeing 787 aircraft are to be incorporated into structured research focused on passenger aircraft used in civilian air transport within the United States. It has been determined that the Boeing 787 has a limited number of aircraft that have been decommissioned or are otherwise not in commercial use. VAS Aero Systems, Inc has been identified as the only known source to currently have salvage rights to a Boeing 787 that can support this requirement.
Please see the attachment labeled, ""justification"" for further detail as to why this action is being negotiated solely with VAS Aero Systems, Inc. Cage Code: 6ZLL8.
There are no solicitation documents; however, contractors interested in this requirement should submit a complete technical package, which provides clear and convincing evidence that they can meet the Government's requirement. Vendors who are not registered in System For Award Management (SAM) database prior to award will not be considered. Vendors may register with SAM by going on via web to https://www.sam.gov. Any responses received without completing SAM registration will be considered noncompliant. Further, the response should include any special requirements for a commercial contract (i.e., Commercial Financing, Warranty Provisions, Delivery Information, etc.) in accordance with FAR Part 12. Responses must be received no later than 11:00 a.m., Eastern Daylight Time, 13 JULY 2018. Responses should be submitted electronically to Solomon.a.raphael.civ@mail.mil.
This notice of intent is not a request for competitive proposals; however, the government will consider all responses received by the response date stated above. A determination by the Government not to compete this acquisition based upon responses to this notice is solely within the discretion of the Government. Information received will normally be considered solely for the purpose of determining whether to conduct a competitive procurement. TELEPHONE REQUEST WILL NOT BE HONORED.",ACC Aberdeen Proving Ground,2018-07-05 17:49:49+00:00,2018-07-05,2018-07-13 16:00:00+00:00,2018-07-13,,Special Notice,SBA,336411,Aircraft Manufacturing ,15,Aerospace Craft And Structural Components,Contract Specialist,Solomon Raphael,solomon.a.raphael.civ@mail.mil,,,Contract Officer,Sharon A. Gary,sharon.a.gary.civ@army.mil,,,"W4QU USA ABERDEEN TEST CENTER
BLDG 358 MICHAELVILLE ROAD",,ABERDEEN PROVING GROUND,MD,21005,USA,,,,,,,,,,,,2100,W91ZLK,W6QK ACC-APG DIR,28332dfbe76c90828e3b962ec4165b47,PI33_DR_IAE_51681,solomon.a.raphael.civ@mail.mil,2018-07-28 08:37:18+00:00,2018-07-05 17:49:49+00:00,https://www.highergov.com/contract-opportunity/W91ZLK-18-Q-0007-Special_Notice-65b47,https://sam.gov/opp/28332dfbe76c90828e3b962ec4165b47/view
