0e8722736df148489186961bc8b24604,BENNINGDPTMSNF00020-1,17--AIRCRAFT TOWBAR ATTACHMENTS,"This is a combined synopsis/solicitation for commercial items prepared in accordance with the format in FAR Subpart 12.6, as supplemented with additional information included in this notice. The solicitation number is BENNINGDPTMSNF00020-1 and is issued as a Request for Quote (RFQ), unless otherwise indicated herein. The solicitation document and incorporated provisions and clauses are those in effect through Federal Acquisition Circular 2020-09. The associated North American Industrial Classification System (NAICS) code for this procurement is  336413 with a small business size standard of 12,507.00 employees. This requirement is a Small Business Set-Aside and only qualified offerors may submit bids.  The solicitation pricing on www.UnisonMarketplace.com will start on the date this solicitation is posted, and, unless otherwise displayed at www.UnisonMarketplace.com, will end on: 2020-09-11 12:00:00.0 Eastern Time. This time supersedes the Offers Due Time listed above. FOB Destination shall be Fort Benning, GA 31905The MICC End User requires the following items, Brand Name or Equal, to the following:  LI 001: AERO Specialties mobile 8-head storage system for up to eight AERO or Tronair multi-towbar heads. Heavy duty stainless steel construction. Includes 2 locking and 2 rigid casters. Additional racks may be bolted together for up to 16 heads., 1, EA;LI 002: AERO Specialties BEC2 towbar head for use with Beechcraft King Air Series, Super King Air Series (including 350), Queen Air Series, Beechcraft 1900, Beechcraft 99, Beechcraft T-44, Beechcraft U-21, Beechcraft C-12 Huron and Sino Swearingen SJ30 aircraft. Compatible towbar(s): TB 1, TB2.5, TB3 (w/Reducer), TB125 (w/Reducer)., 1, EA;LI 003: AERO Specialties towbar head for Gulfstream G2-G650 1,aircraft. Fits GII, GIII-350, GIV-450, GV-550, G650, and G650 ER. Designed with radial & linear shear protection to protect nose gear. Compatible towbar(s): JX, TB125, 1, EA;LI 004: AERO Specialties combo towbar head for the following 598.00
aircraft(s):
Cessna: 310/320/340/401/402/404/411/414/414A/421 & 421C
Gulfstream: Aero Commander and Turbo Commander.
Piper: Aerostar/Cheyenne II/Cheyenne III/Chieftain & Navajo.
Compatible towbar(s): TB1, TB2.5, TB3 (w/Reducer), TB125 (w/Reducer)., 1, EA;LI 005: AERO Specialties CNA3 towbar head for Cessna Citation I, II, V, SII, 525, Bravo, Ultra, Encore, Mustang, CJ1, CJ2, CJ3, CJ4 & all Learjet aircraft (except Lear 85). Compatible towbar(s): TB1 towbar, or JX (w/reducer) or TB125 (w/reducer) or other similar towbar., 1, EA;LI 006: AERO Specialties PC-12 towbar head for Pilatus PC-12 & U-28 aircraft (all). Compatible towbar(s): TB1, TB2.5, TB3 (w/Reducer), TB125 (w/Reducer), 1, EA;Solicitation and Buy Attachments***Question Submission: Interested Offerers must submit any questions concerning the solicitation at the earliest time possible to enable the Buyer to respond. Questions must be submitted by using the 'Submit a Question' feature at www.UnisonMarketplace.com. Questions not received within a reasonable time prior to close of the solicitation may not be considered.***For this solicitation, MICC End User intends to conduct an online competitive reverse auction to be facilitated by the third-party reverse auction provider, Unison, Inc. Unison Marketplace has developed an online, anonymous, browser based application to conduct the reverse auction. An Offeror may submit a series of pricing bids, which descend in price during the specified period of time for the aforementioned reverse auction. MICC End User is taking this action in an effort to improve both vendor access and awareness of requests and the agency's ability to gather multiple, competed, real-time bids. All responsible Offerers that respond to this solicitation MUST submit the pricing portion of their bid using the online exchange located at www.UnisonMarketplace.com. There is no cost to register, review procurement data or make a bid on www.UnisonMarketplace.com. Offerers that are not currently registered to use www.UnisonMarketplace.com should proceed to www.UnisonMarketplace.com to complete their free registration. Offerers that require special considerations or assistance may contact Marketplace Support at 1.877.933.3243 or via email at marketplacesupport@unisonglobal.com. Offerers may not artificially manipulate the price of a transaction on www.UnisonMarketplace.com by any means. It is unacceptable to place bad faith bids, to use decoys in the www.UnisonMarketplace.com process or to collude with the intent or effect of hampering the competitive www.UnisonMarketplace.com process. Should Offerers require additional clarification, notify the point of contact or Marketplace Support at 1.877.933.3243 or marketplacesupport@unisonglobal.com.Use of Unison Marketplace:   Buyers and Sellers agree to conduct this transaction through Unison Marketplace in compliance with the Unison Marketplace Terms of Use. Failure to comply with the below terms and conditions may result in offer being determined as non-responsive.The offeror must comply with the following commercial item terms and conditions: FAR 52.252-1, Solicitation. Provisions Incorporated by Reference; FAR 52.212-1, Instructions to Offerors; 52.212-3, Offeror Representations and Certifications; FAR 52.211-6, Brand name or Equal.The following clauses apply to this solicitation: FAR 52.212-4, Contract Terms and Conditions – Commercial Items. The following FAR clauses in paragraph (b) of FAR clause 52.212-5, Contract Terms and Conditions Required To Implement Statutes or Executive Orders-Commercial Items, apply: 52.204-10, Reporting Executive Compensation and First Tier Subcontract Awards; 52.219-6, Notice of Total Small Business Set-Aside; 52.219-28, Post Award Small Business Program Rerepresentation; 52.222-3, Convict Labor; 52.222-19, Child Labor-Cooperation with Authorities and Remedies; 52.222-21, Prohibition of Segregated Facilities; 52.222-26, Equal Opportunity; 52.222-36, Affirmative Action for Workers with Disabilities; 52.225-13, Restrictions on Certain Foreign Purchases; 52.232-33, Payment by Electronic Funds Transfer--System for Award Management. 52.233-4, Applicable Law for Breach of Contract Claim; The following DFARS clauses apply: DFARS 252.04-7004, Alternate A System for Award Management; 252.211-7003, Item Identification and Valuation; 252.225-7002, Qualifying Country Sources as Subcontractors; 252.232-7010, Levies on Contract Payments; 252.203-7000, Requirements Relating to Compensation of Former DoD Officials; 252.225-7001, Buy American Act and Balance Of  Payments Program; 252.225-7036, Buy American Act -- Free Trade Agreements -- Balance of Payments Program; 252.232-7003, Electronic Submission of Payment Requests; 252.247-7023, Primary and ALT III, Transportation of Supplies by Sea.IAW 52.204-7 System for Award Management (SAM) Registration (July 2013), the offeror must be registered in SAM and fully input their Representations and Certifications for a complete record. Information can be found at http://www.sam.gov or by calling 866-606-8220, or 334-206-7828 for international calls. 52.204-13 - System for Award Management MaintenanceShipping is FOB Destination CONUS (CONtinental U.S.).New Equipment ONLY. NO USED OR REMANUFACTURED PRODUCTS WILL BE ACCEPTED.Submitted Quotes will be valid for 45 days after the auction closing.This solicitation is issued as a Request for Quotation (RFQ), not an invitation for bid (IFB).).IAW FAR 52.252-2 Clauses Incorporated by Reference, the full text of FAR and DFARS Clauses may be accessed electronically at http://farsite.hill.af.mil; and are current to the most recent revision dates posted on this site.The associated North American Industrial Classification System (NAICS) code
for this procurement can be found. The small business size
standard for that NAICS code can be found at https://www.sba.gov/sites/default/files/files/Size_Standards_Table.pdf5152.233-4000 AMC-LEVEL PROTEST PROGRAM (Feb 2014) (LOCAL CLAUSE) Prior to submitting an agency protest, it is preferable that you first attempt to resolve your concerns with the responsible contracting officer (Phone: (315)772-7272 or Email: usarmy.drum.acc-micc.mbx.micc@mail.mil). However, you may also file a protest to the Headquarters (HQ), Army Materiel Command (AMC). The HQ AMC-Level Protest Program is intended to encourage interested parties to seek resolution of their concerns within AMC as an Alternative Dispute Resolution forum, rather than filing a protest with the Government Accountability Office (GAO) or other external forum. Contract award or performance is suspended during the protest to the same extent, and within the same time periods, as if filed at the GAO. The AMC protest decision goal is to resolve protests within 35 calendar days from filing. To be timely, protests must be filed within the periods specified in FAR 33.103. If you want to file a protest under the HQ AMC-Level Protest Program, the protest must request resolution under that program and be sent to the address below. 

Headquarters U.S. Army Materiel Command

Office of Command Counsel-Deputy Command Counsel

4400 Martin Road

Rm: A6SE040.001

Redstone Arsenal, AL 35898-5000

Fax: (256) 450-8840 or email usarmy.redstone.usamc.mbx.protests@mail.mil

The AMC-Level Protest procedures are found at: https://www.amc.army.mil/Connect/Legal-Resources/.

If internet access is not available, contact the contracting officer or HQ, AMC to obtain the HQ AMC-Level Protest Procedures.""52.204-9, Personal Identity Verification of Contractor Personnel; 52.204-10,
Reporting Executive Compensation and First-Tier Subcontract Awards; 52.222-41, Service Contract Act; 52.237-2, Protection of Government
Buildings, Equipment and Vegetation; 252.201-7000, COR Clause; 252.223-7006,
Prohibition On Storage And Disposal Of Toxic And Hazardous Materials;
252.243-7001, Pricing of Contract Modifications; 252.246-7000, Material
inspection and receiving report""Representation by Corporations Regarding an Unpaid Tax Liability or a Felony Conviction under any Federal Law.Wide Area WorkFlow Payment Instructions252.204-7012 Safeguarding of Unclassified Controlled Technical InformationAll deliveries shall be palletized when the material exceeds 250 lbs. (excluding the pallet), or exceeds 20 cubic feet, to comply with the requirements of Department of the Army Pamphlet 700-32 and MIL-STD-147E.This is currently an unfunded requirement with a high expectation that funds will be available. When and if funds become available a contract will be awarded at that time.IAW FAR 52.212-2; Evaluation - Commercial Items, the following factor shall be used to evaluate offers: technical capability of the item offered to meet the Government requirement and price.  Technical capability is more important than price.No multiple awards will be made.  Quotes received through Unison Marketplace will be evaluated and awarded on an all-or-nothing basis.Wide Area WorkFlow Payment InstructionsPlease address your questions through the Unison Marketplace buy. If your questions are not being answered in a timely manner, please send your question to the S2P2 Contracting Officer - usarmy.drum.acc-micc.mbx.micc@mail.mil or call 315-772-5582.In accordance with DFAR provision 252.225-7000  Buy American Act--Balance of Payments Program Certificate,  I certify that each end product, except those listed in paragraphs (c)(2) or (3) of the attached provision, is a domestic end product.  
****YOU MUST FILL OUT THE ATTACHED IF OTHER THAN DOMESTIC END PRODUCT IF YOU DO NOT FILL IT OUT AND YOU DELIVER OTHER THAN A DOMESTIC END PRODUCT YOUR DELIVERY WILL NOT BE ACCEPTED********** ****READ DFARs Clause 252.225-7001 to ensure your product comes from a QUALIFYING COUNTRY******* ****IF YOU QUOTE A PRODUCT OTHER THAN DOMESTIC FROM A NON-QUALIFYING COUNTRY YOUR QUOTE WILL NOT BE ACCEPTED*****Representation and Representation DisclosuresReporting During Contract Performance",MICC Fort Drum,2020-09-04 14:58:12.041000+00:00,2020-09-04,2020-09-11 04:00:00+00:00,2020-09-11,,Synopsis Solicitation,SBA,336413,Other Aircraft Parts and Auxiliary Equipment Manufacturing ,17,"Aerospace Craft Launching, Landing, Ground Handling And Servicing Equipment",,"Name: Marketplace Support, Title: Marketplace Support, Phone: 1.877.933.3243, Fax: 703.422.7822, Email: MarketplaceSupport@unisonglobal.com; ",marketplacesupport@unisonglobal.com,,,,,,,,"Fort Benning, GA",,,,31905,USA,UNITED STATES,,,,,,,,,,,2100,W911S2,W6QM MICC-FT DRUM,0e8722736df148489186961bc8b24604,PI33_DR_IAE_51681,george.m.chavis.civ@mail.mil,2021-03-11 04:55:56.445000+00:00,2020-09-04 14:58:11.963000+00:00,https://www.highergov.com/contract-opportunity/BENNINGDPTMSNF00020-1-Combined_Synopsis_Solicitation-24604,https://sam.gov/opp/0e8722736df148489186961bc8b24604/view
56e82ff35c3a499e8219f89d4d613a88,BENNINGDPTMSNF00020,17--AIRCRAFT TOWBAR ATTACHMENTS,"This is a combined synopsis/solicitation for commercial items prepared in accordance with the format in FAR Subpart 12.6, as supplemented with additional information included in this notice. The solicitation number is BENNINGDPTMSNF00020 and is issued as a Request for Quote (RFQ), unless otherwise indicated herein. The solicitation document and incorporated provisions and clauses are those in effect through Federal Acquisition Circular 2020-09. The associated North American Industrial Classification System (NAICS) code for this procurement is  336413 with a small business size standard of 12,507.00 employees. This requirement is a Small Business Set-Aside and only qualified offerors may submit bids.  The solicitation pricing on www.UnisonMarketplace.com will start on the date this solicitation is posted, and, unless otherwise displayed at www.UnisonMarketplace.com, will end on: 2020-09-11 12:00:00.0 Eastern Time. This time supersedes the Offers Due Time listed above. FOB Destination shall be Fort Benning, GA 31905The MICC End User requires the following items, Brand Name or Equal, to the following:  LI 001: AERO Specialties mobile 8-head storage system for up to eight AERO or Tronair multi-towbar heads. Heavy duty stainless steel construction. Includes 2 locking and 2 rigid casters. Additional racks may be bolted together for up to 16 heads., 1, EA;LI 002: AERO Specialties BEC2 towbar head for use with Beechcraft King Air Series, Super King Air Series (including 350), Queen Air Series, Beechcraft 1900, Beechcraft 99, Beechcraft T-44, Beechcraft U-21, Beechcraft C-12 Huron and Sino Swearingen SJ30 aircraft. Compatible towbar(s): TB 1, TB2.5, TB3 (w/Reducer), TB125 (w/Reducer)., 1, EA;LI 003: AERO Specialties towbar head for Gulfstream G2-G650 1,aircraft. Fits GII, GIII-350, GIV-450, GV-550, G650, and G650 ER. Designed with radial & linear shear protection to protect nose gear. Compatible towbar(s): JX, TB125, 1, EA;LI 004: AERO Specialties combo towbar head for the following 598.00
aircraft(s):
Cessna: 310/320/340/401/402/404/411/414/414A/421 & 421C
Gulfstream: Aero Commander and Turbo Commander.
Piper: Aerostar/Cheyenne II/Cheyenne III/Chieftain & Navajo.
Compatible towbar(s): TB1, TB2.5, TB3 (w/Reducer), TB125 (w/Reducer)., 1, EA;LI 005: AERO Specialties CNA3 towbar head for Cessna Citation I, II, V, SII, 525, Bravo, Ultra, Encore, Mustang, CJ1, CJ2, CJ3, CJ4 & all Learjet aircraft (except Lear 85). Compatible towbar(s): TB1 towbar, or JX (w/reducer) or TB125 (w/reducer) or other similar towbar., 1, EA;LI 006: AERO Specialties PC-12 towbar head for Pilatus PC-12 & U-28 aircraft (all). Compatible towbar(s): TB1, TB2.5, TB3 (w/Reducer), TB125 (w/Reducer), 1, EA;Solicitation and Buy Attachments***Question Submission: Interested Offerers must submit any questions concerning the solicitation at the earliest time possible to enable the Buyer to respond. Questions must be submitted by using the 'Submit a Question' feature at www.UnisonMarketplace.com. Questions not received within a reasonable time prior to close of the solicitation may not be considered.***For this solicitation, MICC End User intends to conduct an online competitive reverse auction to be facilitated by the third-party reverse auction provider, Unison, Inc. Unison Marketplace has developed an online, anonymous, browser based application to conduct the reverse auction. An Offeror may submit a series of pricing bids, which descend in price during the specified period of time for the aforementioned reverse auction. MICC End User is taking this action in an effort to improve both vendor access and awareness of requests and the agency's ability to gather multiple, competed, real-time bids. All responsible Offerers that respond to this solicitation MUST submit the pricing portion of their bid using the online exchange located at www.UnisonMarketplace.com. There is no cost to register, review procurement data or make a bid on www.UnisonMarketplace.com. Offerers that are not currently registered to use www.UnisonMarketplace.com should proceed to www.UnisonMarketplace.com to complete their free registration. Offerers that require special considerations or assistance may contact Marketplace Support at 1.877.933.3243 or via email at marketplacesupport@unisonglobal.com. Offerers may not artificially manipulate the price of a transaction on www.UnisonMarketplace.com by any means. It is unacceptable to place bad faith bids, to use decoys in the www.UnisonMarketplace.com process or to collude with the intent or effect of hampering the competitive www.UnisonMarketplace.com process. Should Offerers require additional clarification, notify the point of contact or Marketplace Support at 1.877.933.3243 or marketplacesupport@unisonglobal.com.Use of Unison Marketplace:   Buyers and Sellers agree to conduct this transaction through Unison Marketplace in compliance with the Unison Marketplace Terms of Use. Failure to comply with the below terms and conditions may result in offer being determined as non-responsive.The offeror must comply with the following commercial item terms and conditions: FAR 52.252-1, Solicitation. Provisions Incorporated by Reference; FAR 52.212-1, Instructions to Offerors; 52.212-3, Offeror Representations and Certifications; FAR 52.211-6, Brand name or Equal.The following clauses apply to this solicitation: FAR 52.212-4, Contract Terms and Conditions – Commercial Items. The following FAR clauses in paragraph (b) of FAR clause 52.212-5, Contract Terms and Conditions Required To Implement Statutes or Executive Orders-Commercial Items, apply: 52.204-10, Reporting Executive Compensation and First Tier Subcontract Awards; 52.219-6, Notice of Total Small Business Set-Aside; 52.219-28, Post Award Small Business Program Rerepresentation; 52.222-3, Convict Labor; 52.222-19, Child Labor-Cooperation with Authorities and Remedies; 52.222-21, Prohibition of Segregated Facilities; 52.222-26, Equal Opportunity; 52.222-36, Affirmative Action for Workers with Disabilities; 52.225-13, Restrictions on Certain Foreign Purchases; 52.232-33, Payment by Electronic Funds Transfer--System for Award Management. 52.233-4, Applicable Law for Breach of Contract Claim; The following DFARS clauses apply: DFARS 252.04-7004, Alternate A System for Award Management; 252.211-7003, Item Identification and Valuation; 252.225-7002, Qualifying Country Sources as Subcontractors; 252.232-7010, Levies on Contract Payments; 252.203-7000, Requirements Relating to Compensation of Former DoD Officials; 252.225-7001, Buy American Act and Balance Of  Payments Program; 252.225-7036, Buy American Act -- Free Trade Agreements -- Balance of Payments Program; 252.232-7003, Electronic Submission of Payment Requests; 252.247-7023, Primary and ALT III, Transportation of Supplies by Sea.IAW 52.204-7 System for Award Management (SAM) Registration (July 2013), the offeror must be registered in SAM and fully input their Representations and Certifications for a complete record. Information can be found at http://www.sam.gov or by calling 866-606-8220, or 334-206-7828 for international calls. 52.204-13 - System for Award Management MaintenanceShipping is FOB Destination CONUS (CONtinental U.S.).New Equipment ONLY. NO USED OR REMANUFACTURED PRODUCTS WILL BE ACCEPTED.Submitted Quotes will be valid for 45 days after the auction closing.This solicitation is issued as a Request for Quotation (RFQ), not an invitation for bid (IFB).).IAW FAR 52.252-2 Clauses Incorporated by Reference, the full text of FAR and DFARS Clauses may be accessed electronically at http://farsite.hill.af.mil; and are current to the most recent revision dates posted on this site.The associated North American Industrial Classification System (NAICS) code
for this procurement can be found. The small business size
standard for that NAICS code can be found at https://www.sba.gov/sites/default/files/files/Size_Standards_Table.pdf5152.233-4000 AMC-LEVEL PROTEST PROGRAM (Feb 2014) (LOCAL CLAUSE) Prior to submitting an agency protest, it is preferable that you first attempt to resolve your concerns with the responsible contracting officer (Phone: (315)772-7272 or Email: usarmy.drum.acc-micc.mbx.micc@mail.mil). However, you may also file a protest to the Headquarters (HQ), Army Materiel Command (AMC). The HQ AMC-Level Protest Program is intended to encourage interested parties to seek resolution of their concerns within AMC as an Alternative Dispute Resolution forum, rather than filing a protest with the Government Accountability Office (GAO) or other external forum. Contract award or performance is suspended during the protest to the same extent, and within the same time periods, as if filed at the GAO. The AMC protest decision goal is to resolve protests within 35 calendar days from filing. To be timely, protests must be filed within the periods specified in FAR 33.103. If you want to file a protest under the HQ AMC-Level Protest Program, the protest must request resolution under that program and be sent to the address below. 

Headquarters U.S. Army Materiel Command

Office of Command Counsel-Deputy Command Counsel

4400 Martin Road

Rm: A6SE040.001

Redstone Arsenal, AL 35898-5000

Fax: (256) 450-8840 or email usarmy.redstone.usamc.mbx.protests@mail.mil

The AMC-Level Protest procedures are found at: https://www.amc.army.mil/Connect/Legal-Resources/.

If internet access is not available, contact the contracting officer or HQ, AMC to obtain the HQ AMC-Level Protest Procedures.""52.204-9, Personal Identity Verification of Contractor Personnel; 52.204-10,
Reporting Executive Compensation and First-Tier Subcontract Awards; 52.222-41, Service Contract Act; 52.237-2, Protection of Government
Buildings, Equipment and Vegetation; 252.201-7000, COR Clause; 252.223-7006,
Prohibition On Storage And Disposal Of Toxic And Hazardous Materials;
252.243-7001, Pricing of Contract Modifications; 252.246-7000, Material
inspection and receiving report""Representation by Corporations Regarding an Unpaid Tax Liability or a Felony Conviction under any Federal Law.Wide Area WorkFlow Payment Instructions252.204-7012 Safeguarding of Unclassified Controlled Technical InformationAll deliveries shall be palletized when the material exceeds 250 lbs. (excluding the pallet), or exceeds 20 cubic feet, to comply with the requirements of Department of the Army Pamphlet 700-32 and MIL-STD-147E.This is currently an unfunded requirement with a high expectation that funds will be available. When and if funds become available a contract will be awarded at that time.IAW FAR 52.212-2; Evaluation - Commercial Items, the following factor shall be used to evaluate offers: technical capability of the item offered to meet the Government requirement and price.  Technical capability is more important than price.No multiple awards will be made.  Quotes received through Unison Marketplace will be evaluated and awarded on an all-or-nothing basis.Wide Area WorkFlow Payment InstructionsPlease address your questions through the Unison Marketplace buy. If your questions are not being answered in a timely manner, please send your question to the S2P2 Contracting Officer - usarmy.drum.acc-micc.mbx.micc@mail.mil or call 315-772-5582.In accordance with DFAR provision 252.225-7000  Buy American Act--Balance of Payments Program Certificate,  I certify that each end product, except those listed in paragraphs (c)(2) or (3) of the attached provision, is a domestic end product.  
****YOU MUST FILL OUT THE ATTACHED IF OTHER THAN DOMESTIC END PRODUCT IF YOU DO NOT FILL IT OUT AND YOU DELIVER OTHER THAN A DOMESTIC END PRODUCT YOUR DELIVERY WILL NOT BE ACCEPTED********** ****READ DFARs Clause 252.225-7001 to ensure your product comes from a QUALIFYING COUNTRY******* ****IF YOU QUOTE A PRODUCT OTHER THAN DOMESTIC FROM A NON-QUALIFYING COUNTRY YOUR QUOTE WILL NOT BE ACCEPTED*****Representation and Representation DisclosuresReporting During Contract Performance",MICC Fort Drum,2020-09-01 12:19:27.673000+00:00,2020-09-01,2020-09-11 04:00:00+00:00,2020-09-11,,Synopsis Solicitation,SBA,336413,Other Aircraft Parts and Auxiliary Equipment Manufacturing ,17,"Aerospace Craft Launching, Landing, Ground Handling And Servicing Equipment",,"Name: Marketplace Support, Title: Marketplace Support, Phone: 1.877.933.3243, Fax: 703.422.7822, Email: MarketplaceSupport@unisonglobal.com; ",marketplacesupport@unisonglobal.com,,,,,,,,"Fort Benning, GA",,,,31905,USA,UNITED STATES,,,,,,,,,,,2100,W911S2,W6QM MICC-FT DRUM,56e82ff35c3a499e8219f89d4d613a88,PI33_DR_IAE_51681,george.m.chavis.civ@mail.mil,2020-09-04 15:03:54.105000+00:00,2020-09-01 12:19:27.585000+00:00,https://www.highergov.com/contract-opportunity/BENNINGDPTMSNF00020-Combined_Synopsis_Solicitation-13a88,https://sam.gov/opp/56e82ff35c3a499e8219f89d4d613a88/view
