f5315153c76b63f6dfb55ee3ab89dcd6,15DDHQ18N00000020,Cessna T206 Aircraft,See Notice of Intent attached,Drug Enforcement Administration,2018-06-01 17:56:01+00:00,2018-06-01,2018-06-15 19:00:00+00:00,2018-06-15,,Special Notice,,336411,Aircraft Manufacturing ,15,Aerospace Craft And Structural Components,,Ryan Burke,ryan.f.burke@usdoj.gov,,,,,,,,,,,,,,,,,,,,,,,,,1524,DEAHQ,HEADQUATERS,f5315153c76b63f6dfb55ee3ab89dcd6,PI33_DR_IAE_51681,ryan.f.burke@usdoj.gov,2018-06-16 08:41:00+00:00,2018-06-01 17:56:01+00:00,https://www.highergov.com/contract-opportunity/15DDHQ18N00000020-Special_Notice-9dcd6,https://sam.gov/opp/f5315153c76b63f6dfb55ee3ab89dcd6/view
c858468cbf00a477af2ec951cb9bb8e1,126395Q180109,Piper PA18 Maintenance and repairs in ID,"1. This is a combined synopsis/solicitation for commercial services- prepared in accordance with Federal Acquisition Regulation (FAR) 12 and Part 13 and supplemental information included in this notice. This announcement constitutes the only solicitation; quotations are being requested and a written solicitation will not be issued. This combined synopsis/solicitation will result in a firm fixed price IDIQ commercial service contract.
2. The solicitation number for this effort is 126395Q180109 and this combined synopsis/solicitation is issued as a request for quotation (RFQ).
3. The provisions and clauses incorporated into this solicitation document are those in effect at the time of publication. Provisions and clauses incorporated by reference have the same force and effect as if they were given in full text. The full text of the Federal Acquisition Regulation (FAR) can be accessed on the Internet at http://farsite.hill.af.mil/
4. Simplified procurement procedures will be used for this acquisition per Federal Acquisition Regulation (FAR) Part 13. This requirement is being offered as a Small Business Set-Aside. The NAICS code is 488190. The small business size standard is $32.5 million.
5. This requirement is for fixed wing aircraft (Cessna) Maintenance, inspection and repair Services to support the United States Department of Agriculture (USDA), Animal Plant Health Inspection Service (APHIS), Wildlife Service (WS) in Idaho.6. REQUIREMENTS AND QUANTITIES: See attached schedule, statement of work and additional clauses.
7. The period of performance will be 5 years.
8. The provision at 52.212-1 Instructions to Offerors - Commercial Items (Jan 2017) applies to this solicitation.
9. Award will be made to the responsible offeror whose offer conforming to this combined synopsis/solicitation will be most advantageous to the Government, price and other factors considered. The following factors shall be used to evaluate offers: Price, Technical capability such as; experience with Cessna aircraft, location to aircraft base and Past performance.
10. The provision 52.212-3 Offeror Representations and Certifications - Commercial Items (Jan 2017) applies to this solicitation. The contractor shall either complete the on-line Offeror Representations and Certifications www.SAM.gov or return a completed copy of the Offeror Representations and Certifications with their quotation.
11. The clause at 52.212-4 Contract Terms and Conditions - Commercial Items (Jan 2017) applies to this acquisition.
12. The clause at 52.212-5 Contract Terms and Conditions Required to Implement Statutes or Executive Orders (June 2016) Commercial Items, applies to this acquisition. See attached schedule, SOW for FAR clauses identified in FAR 52.212-5 that are considered checked and are applicable to this acquisition;
13. To be awarded this contract, the offeror must be registered in SAM.gov. SAM.gov information may be found at http://www.SAM.gov.
14. Quotations are due to the United States Department of Agriculture, Minneapolis Contracting Office, 250 Marquette Ave Suite 410, Minneapolis, MN 55401 by 1:30 PM CT, May 01, 2018. Quotes may be sent via e-mail to Jason.l.wilking@aphis.usda.gov. The point of contact for this combined synopsis solicitation is Jason Wilking who may be reached at Jason.l.wilking@aphis.usda.gov.
15. Quotes should consist of the following:a. A completed pricing schedule b. Technical information for evaluation and Past performance references for projects similar to the work required in this contract. References must include contact name, phone number, e-mail address, and a description of the work.
d. A completed copy of the provisions at FAR 52.212-3, Offeror Representations and Certifications-Commercial Items or if not completed in SAM.gov.
.",APHIS Headquarters,2018-04-13 20:51:36+00:00,2018-04-13,2018-05-01 19:30:00+00:00,2018-05-01,,Synopsis Solicitation,SBA,488190,Other Support Activities for Air Transportation,J,"Maint, Repair, Rebuild Equipment",,Jason L Wilking,Jason.L.Wilking@aphis.usda.gov,612-336-3210,,,,,,,TBD,,TBD,ID,TBD,USA,,,,,,,,,,,,,,Procurement Branch,c858468cbf00a477af2ec951cb9bb8e1,PI33_DR_IAE_51681,Jason.L.Wilking@usda.gov,2018-07-21 08:45:42+00:00,2018-04-13 20:51:36+00:00,https://www.highergov.com/contract-opportunity/126395Q180109-Combined_Synopsis_Solicitation-bb8e1,https://sam.gov/opp/c858468cbf00a477af2ec951cb9bb8e1/view
438f63d0d2f837c049ef5fa5ab736233,140D8118Q0002,"N--Avionics Upgrade for two (2) DOI Fleet Aircraft, N","Avionics Upgrade for two (2) DOI Fleet Aircraft, N6352Z (Cessna 206G) and N9395N (Cessna 185).",Interior Business Center,2018-01-19 00:09:38+00:00,2018-01-19,,,,Award Notice,,488190,Other Support Activities for Air Transportation,N,Installation Of Equipment,,"Barcelona, Brian",,,,,,,,,,,,,,,,a0a6d7d4b11cede665ed89ff49018cce,2018-01-18,136230.00,140D8118P0011,,,PENINSULA AERO TECHNOLOGY<br />135 GRANITE POINT CT<br />KENAI<br />AK<br />99611-7711<br />US,DD92J5ADJFK1,,,1406,00004,IBC ACQ SVCS DIRECTORATE (00004),438f63d0d2f837c049ef5fa5ab736233,PI33_DR_IAE_51681,fbms_acq@ios.doi.gov,2018-02-02 09:36:40+00:00,2018-01-19 00:09:38+00:00,https://www.highergov.com/contract-opportunity/140D8118Q0002-Award_Notice-PENINSULA_AERO_TECHNOLOGYbr_135_GRANITE_POINT_CTbr_KENAIbr_AKbr_99611-7711br_US-36233,https://sam.gov/opp/438f63d0d2f837c049ef5fa5ab736233/view
194516da340cd0c912109ad59a2ca5e8,140D8118Q0002,"N--Avionics Upgrade for two (2) DOI Fleet Aircraft, N","Avionics Upgrade for two (2) DOI Fleet Aircraft, N6352Z (Cessna 206G) and N9395N (Cessna 185).",Interior Business Center,2018-01-02 19:34:35+00:00,2018-01-02,2018-01-08 05:00:00+00:00,2018-01-08,,Synopsis Solicitation,SBA,488190,Other Support Activities for Air Transportation,N,Installation Of Equipment,,"Barcelona, Brian",,,,,,,,,,,,,,,,,,,,,,,,,,1406,00004,IBC ACQ SVCS DIRECTORATE (00004),a0a6d7d4b11cede665ed89ff49018cce,PI33_DR_IAE_51681,fbms_acq@ios.doi.gov,2018-02-02 09:36:40+00:00,2018-01-02 19:34:35+00:00,https://www.highergov.com/contract-opportunity/140D8118Q0002-Combined_Synopsis_Solicitation-18cce,https://sam.gov/opp/194516da340cd0c912109ad59a2ca5e8/view
7b2e6a32be98e937379bef3044847584,140D8018R0002,"NPS Cessna 206  Big Bend, TX",No Description Provided,Interior Business Center,2017-12-21 17:26:12+00:00,2017-12-21,2018-01-05 05:00:00+00:00,2018-01-05,,Synopsis Solicitation,,336411,Aircraft Manufacturing ,15,Aerospace Craft And Structural Components,,"Anderson, John",,,,,,,,,,,,,,,,,,,,,,,,,,1406,00004,IBC ACQ SVCS DIRECTORATE (00004),7b2e6a32be98e937379bef3044847584,PI33_DR_IAE_51681,fbms_acq@ios.doi.gov,2018-01-12 09:36:41+00:00,2017-12-21 17:26:12+00:00,https://www.highergov.com/contract-opportunity/140D8018R0002-Combined_Synopsis_Solicitation-47584,https://sam.gov/opp/7b2e6a32be98e937379bef3044847584/view
e2bcbda69780d76868f6bf4196251bd5,Ref-18-019,Sources Sought for SBIRS Contractor Logistics Support,SOC Submission Update: Please submit SOCs to both the address above and also to Capt Richardson at Andrew.richardson.12@us.af.mil,Space Systems Command,2017-12-13 15:47:04+00:00,2017-12-13,2017-12-14 23:00:00+00:00,2017-12-14,,Sources Sought,,541330,Engineering Services,R,"Support Services (Prof, Admin, Mgmt)",,Brent Jorgensen,brent.jorgensen.1@us.af.mil,,,,Tena Cessna,tena.cessna@us.af.mil,,,"Peterson AFB, CO, Buckley AFB, CO, Schriever AFB, CO, Los Angeles AFB, CA, and several classified OCONUS sites.",,,,,USA,,,,,,,,,,,,5700,FA8823,FA8823  SUSTAINMENT PKL,febc0d8841bdc3630daa943b5b5ac4ae,PI33_DR_IAE_51681,brent.jorgensen.1@us.af.mil,2017-12-29 09:37:26+00:00,2017-12-13 15:47:04+00:00,https://www.highergov.com/contract-opportunity/Ref-18-019-Sources_Sought-ac4ae,https://sam.gov/opp/e2bcbda69780d76868f6bf4196251bd5/view
e1344e542d569f41dd3be042aad19fcf,140D8118R0002,Engine Contract for Fixed-Wing OAS Fleet Aircraft,"THIS IS A REQUEST FOR INFORMATION/SOURCES SOUGHT for market research purposes to identify interested vendors for the potential requirement detailed below.  A formal solicitation and statement of work are not available.  THIS IS NOT A REQUEST FOR PROPOSALS.  Additionally, in accordance with FAR 19.5, Set-Asides for Small Business, the Government will review the information requested in this announcement to determine the type of set-aside (if any) for this requirement, should it come to fruition.

The Department of the Interior (DOI), Interior Business Center, AQD, on behalf the DOI - Office of Aviation Services, Alaska Regional Office, Anchorage, AK, requires OEM New or Factory rebuilt piston engines for fixed-wing aircraft.  

The North American Industry Classification System (NAICS) code is 336412 Aircraft Engine and Engine Parts Manufacturing and the size standard is 1500 employees.

Description of Requirement:

The Office of Aviation Services requires a manufacturer or a factory authorized distributer for new or factory rebuilt reciprocating (piston) aircraft engines.  Engine core swaps are envisioned and will be handled by any potential vendor.  Engines will be needed for the following aircraft:

Cessna U206F, U206G, 206H, T206G
Cessna 182R&P, 182RG, 185F
Cubcrafters CC-18
Found Bush Hawk
Partenavia P68 & P68TC series
Piper PA-18
Husky A-1B

**All engines must be swapped in accordance with the FAA certification of individual aircraft and will be requested as such in any future contract.  

Specific engine makes and model are not being requested with this notice, only information regarding the ability to provide engines is needed at this time.

All business concerns who believe they can responsibly perform this requirement should submit the following information to the contract specialist no later than 1600 EST Wednesday, November 29, 2017:

1.	Capability statement describing corporate expertise and technical qualifications in the work described above.  Please provide all makes of engines respondent is authorized to distribute.
2.	Past performance information describing other contracts for similar services your company has been awarded.  Past performance information should be submitted for performance within the last three years and include: location, whether the work was as a prime or subcontractor, contract/subcontract dollar value, type of contract, and overall performance rating received.




3.	Small business status of vendor (8(a), HUBZone, SDVOSB, etc.)
4.	Point of contact information for vendor, cage code, and D&B Number.
5.	Any other information that will prove the vendor is capable of performing the required effort.

NOTE: All information submitted in response to this announcement is voluntary - the Government will not pay for information requested nor will it compensate any respondent for any cost incurred in developing information provided to the Government.  Materials submitted to the Government for review will not be returned.  Respondents will not be notified of the results of the evaluation.  This is not a request for proposals.  The Government will not award a contract based on responses received under this announcement.

All questions and concerns may be submitted to the contract Specialist via email only at emelia_flaherty@ibc.doi.gov.
",Interior Business Center,2017-11-22 00:20:56+00:00,2017-11-22,2017-11-29 05:00:00+00:00,2017-11-29,,Sources Sought,,336412,Aircraft Engine and Engine Parts Manufacturing ,28,Engines And Turbines And Component,,"Flaherty, Emelia",,,,,,,,,,,,,,,,,,,,,,,,,,1406,00004,IBC ACQ SVCS DIRECTORATE (00004),e1344e542d569f41dd3be042aad19fcf,PI33_DR_IAE_51681,fbms_acq@ios.doi.gov,2017-11-29 09:37:04+00:00,2017-11-22 00:20:56+00:00,https://www.highergov.com/contract-opportunity/140D8118R0002-Sources_Sought-19fcf,https://sam.gov/opp/e1344e542d569f41dd3be042aad19fcf/view
a35ea00cb8c211873321c61af79b6656,INLATD012,Health and Usage Monitoring System (HUMS) for Fixed/Rotary-Wing Aircraft,"THIS IS A REQUEST FOR INFORMATION (RFI) ONLY. This RFI is issued solely for information and planning purposes - it does not constitute a Request for Proposal (RFP) or a promise to issue an RFP in the future. This request for information does not commit the Government to contract for any supply or service. The U.S. Government will not pay for any information or administrative costs incurred in response to this RFI. All costs associated with responding to this RFI will be solely at the interested party's expense. Any pricing provided is not binding but may be used for planning purposes. Proprietary information, if any, should be minimized and MUST BE CLEARLY MARKED. Please be advised that all submissions become Government property and will not be returned.
1.0 Description
1.1 B3 Solutions LLC, in support of the Department of State (DoS) Bureau of International Narcotics and Law Enforcement Affairs Office of Aviation (INL/A) is seeking commercially available options (and rough order of magnitude pricing) for Health and Usage Monitoring Systems and associated trend analysis and reporting services for the following aircraft types:
Fixed Wing:  Pilatus Porter PC-6  Raytheon - Beech 1900D  Cessna C-208B  Bombardier DHC-8-315
Rotary Wing:  Boeing CH-46E  Sikorsky S-61T  Bell UH-1H-II  Bell UN-1N &lrm; McDonnell Douglas MD-530F
1.2 Commonality and standardization across the fleet is desired. If impractical, a common solution for fixed wing aircraft types and a separate but common solution for rotary wing aircraft types is acceptable. If commonality and standardization cannot be achieved, information on systems suitable for and compatible with each aircraft type should be provided. Information on trend analysis and reporting services for each system is also requested.
2.0 General Requirements for HUMS
&bull; Fully FAA certified&bull; Qualified to DO-160G/MIL-STD-810G requirements
3.0 Responses
3.1 Interested parties are requested to respond to this RFI via email NLT December 1, 2017, 12:00pm EST to shaughton@b3solutions.com and mhoffman@b3solutions.com. Proprietary information, if any, should be minimized and MUST BE CLEARLY MARKED. Please be advised that all submissions become Government property and will not be returned.
3.2. Your response must provide the data requested below:
  3.2.1 Name, mailing address, phone number and e-mail of designated point of contact.
  3.2.2 Description of recommended commercial solution(s): Technical specifications, capabilities, and aircraft compatibility
  3.2.3 Trend analysis and reporting services available for each system
  3.2.4 Rough order of magnitude pricing for each system
  3.2.5 Installation requirements and/or estimated time/complexity of installation for each system
  3.2.6 Examples of where each product is currently being used (references requested)
  3.2.7 If your recommended solution does not meet (or exceeds) any of the above requirements, please explain why you feel your recommended solution should still be considered.
3.3. Please direct any questions related to the technical aspects of this requirement to Steve Haughton at shaughton@b3solutions.com.",DOS Office of Acquisition Management,2017-11-15 19:06:46+00:00,2017-11-15,2017-12-01 17:00:00+00:00,2017-12-01,,Sources Sought,,334511,"Search, Detection, Navigation, Guidance, Aeronautical, and Nautical System and Instrument Manufacturing ",16,Aerospace Craft Components And Accessories,Maintenance Subject Matter Expert,Steve Haughton,shaughton@b3solutions.com,321-783-9821 EXT: 30043,,Program Support,Marc Hoffman,mhoffman@b3solutions.com,"321-783-9865, Ext. 33557",,,,,,,,,,,,,,,,,,,,,INL Support,a35ea00cb8c211873321c61af79b6656,PI33_DR_IAE_51681,hoffmanm.ctr@ginl.state.gov,2017-12-16 09:37:48+00:00,2017-11-15 16:58:15+00:00,https://www.highergov.com/contract-opportunity/INLATD012-Sources_Sought-b6656,https://sam.gov/opp/a35ea00cb8c211873321c61af79b6656/view
80c02a0d364c9285739f8ad515aae3b0,N6134018R0038,"J--Sources Sought Notice for UC-35C/D Contractor Logistic Support.
","Please see the attached Sources Sought Notice and DRAFT Performance Work Statement (PWS) for UC-35C/D Contractor Logistic Support.

The Fast Acquisition Solutions To Enable Readiness (FASTER) Team and the Tactical Airlift Program Office, PMA207 at the Naval Air Systems Command (NAVAIR), Patuxent River, MD are conducting a Market Survey of Industry to determine potential interested sources that have the skills and experience required to successfully provide Contractor Logistics Support (CLS) for the UC-35 platform.  

This Sources Sought is a Request for Information (RFI) for market survey purposes only.  This is not a solicitation for proposals and no contract shall be awarded from this announcement.
  The purpose of this announcement is for Market Research only and is in accordance with (IAW) Federal Acquisition Regulation (FAR) Part 10 and is being issued IAW FAR subpart 15.201(e). No reimbursement shall be made for any costs associated with providing information in response to this announcement or any follow up information requests. Nothing shall be construed herein or through this market research process to commit or obligate the Government to further action as a result of this research.

The Government intends to use this information to best determine whether the UC-35C/D should be competed via â€œfull and open competitionâ€� or as a â€œsmall business set-asideâ€�.  The Government may fill this requirement as a Task Order under the Contract Maintenance, Modification, Aircrew, and Related Services (CMMARS) Multiple Award Contract (MAC), as a task order under a small business Contract Logistics Support (CLS) MAC, and/or as a standalone contract.
  

Program Description:
The UC-35C is a Citation V Ultra, Cessna 560, and the UC-35D is a Citation Encore, Cessna 560, aircraft series manufactured by Cessna Aircraft Company.  It is a multipurpose, low-wing, business-jet monoplane with a pod-mounted engine on each side of the fuselage.    The aircraft can accommodate passengers, cargo or both.  The UC-35 C/D fleet is located at multiple sites around the United States and overseas, and is responsible for the transport of high priority passengers and cargo with time, place or mission sensitive requirements.

Please see the attachments for more details and questions.

Classified material SHALL NOT be submitted. All proprietary or corporate data received shall be clearly identified and will be protected from release to sources outside the Government.
  Any resulting contract is anticipated to have a security classification level of Secret at time of contract award for personnel and facilities clearances. 

One electronically submitted response shall be received no later than 2 PM EST on 24 November 2017 and reference: UC-35C/D Sources Sought. Responses to this request may not be returned.

DISCLAIMER
THIS SOURCES SOUGHT IS FOR INFORMATIONAL PURPOSES ONLY. THIS IS NOT A REQUEST FOR PROPOSAL. IT DOES NOT CONSTITUTE A SOLICITATION AND SHALL NOT BE CONSTRUED AS A COMMITMENT BY THE GOVERNMENT.    RESPONSES  IN  ANY  FORM  ARE  NOT  OFFERS  AND  THE  GOVERNMENT  IS  UNDER  NO OBLIGATION TO AWARD A CONTRACT AS A RESULT OF THIS ANNOUNCEMENT.
  NO FUNDS ARE AVAILABLE TO PAY FOR PREPARATION OF RESPONSES TO THIS ANNOUNCEMENT.   ANY INFORMATION SUBMITTED BY RESPONDENTS TO THIS TECHNICAL DESCRIPTION IS STRICTLY VOLUNTARY. ",NAWC Training Systems Division,2017-11-06 18:19:53+00:00,2017-11-06,2017-11-24 05:00:00+00:00,2017-11-24,,Sources Sought,,488190,Other Support Activities for Air Transportation,J,"Maint, Repair, Rebuild Equipment",,"Jonathan Catalano
407-380-8160

Ty Jean-Louis
407-380-4489",,,,,,,,,,,,,,,,,,,,,,,,,,1700,N61340,NAWC TRAINING SYSTEMS DIV,80c02a0d364c9285739f8ad515aae3b0,PI33_DR_IAE_51681,noreply@fbo.gov,2018-10-05 08:52:44+00:00,2017-11-06 18:19:53+00:00,https://www.highergov.com/contract-opportunity/N6134018R0038-Sources_Sought-ae3b0,https://sam.gov/opp/80c02a0d364c9285739f8ad515aae3b0/view
79a43ad9a7484a7ad26e8ad9f8a62cd9,AG-6395-S-17-0183,Cessna Aircraft Maintenance Services,"1. This is a combined synopsis/solicitation for commercial services- prepared in accordance with Federal Acquisition Regulation (FAR) 12 and Part 13 and supplemental information included in this notice. This announcement constitutes the only solicitation; quotations are being requested and a written solicitation will not be issued. This combined synopsis/solicitation will result in a firm fixed price IDIQ commercial service contract.
2. The solicitation number for this effort is AG-6395-S-17-0183 and this combined synopsis/solicitation is issued as a request for quotation (RFQ).
3. The provisions and clauses incorporated into this solicitation document are those in effect at the time of publication. Provisions and clauses incorporated by reference have the same force and effect as if they were given in full text. The full text of the Federal Acquisition Regulation (FAR) can be accessed on the Internet at http://farsite.hill.af.mil/
4. Simplified procurement procedures will be used for this acquisition per Federal Acquisition Regulation (FAR) Part 13. This requirement is being offered as a Small Business Set-Aside. The NAICS code is 488190. The small business size standard is $32.5 million.
5. This requirement is for Fixed wing aircraft (Cessna) Maintenance, inspection and repair Services to support the United States Department of Agriculture (USDA), Animal Plant Health Inspection Service (APHIS), Wildlife Service (WS) in Kentucky6. REQUIREMENTS AND QUANTITIES: See attached schedule, statement of work and additional clauses.
7. The period of performance will be 5 years.
8. The provision at 52.212-1 Instructions to Offerors - Commercial Items (Jan 2017) applies to this solicitation.
9. Award will be made to the responsible offeror whose offer conforming to this combined synopsis/solicitation will be most advantageous to the Government, price and other factors considered. The following factors shall be used to evaluate offers: Price, Technical capability such as; experience with Cessna aircraft, location to aircraft base and Past performance.
10. The provision 52.212-3 Offeror Representations and Certifications - Commercial Items (Jan 2017) applies to this solicitation. The contractor shall either complete the on-line Offeror Representations and Certifications www.SAM.gov or return a completed copy of the Offeror Representations and Certifications with their quotation.
11. The clause at 52.212-4 Contract Terms and Conditions - Commercial Items (Jan 2017) applies to this acquisition.
12. The clause at 52.212-5 Contract Terms and Conditions Required To Implement Statutes Or Executive Orders (June 2016) Commercial Items, applies to this acquisition. See attached schedule, SOW for FAR clauses identified in FAR 52.212-5 that are considered checked and are applicable to this acquisition;
13. To be awarded this contract, the offeror must be registered in SAM.gov. SAM.gov information may be found at http://www.SAM.gov.
14. Quotations are due to the United States Department of Agriculture, Minneapolis Contracting Office, 250 Marquette Ave Suite 410, Minneapolis, MN 55401 by 1:30 PM CST, June 05, 2017. Quotes may be sent via e-mail to Jason.l.wilking@aphis.usda.gov. The point of contact for this combined synopsis solicitation is Jason Wilking who may be reached at Jason.l.wilking@aphis.usda.gov.
15. A COMPLETE QUOTE WILL CONSIST OF THE FOLLOWING:a. A completed pricing schedule b. Technical information for evaluation and Past performance references for projects similar to the work required in this contract. References must include contact name, phone number, e-mail address, and a description of the work.
d. A completed copy of the provisions at FAR 52.212-3, Offeror Representations and Certifications-Commercial Items or if not completed in SAM.gov.
.",APHIS Headquarters,2017-09-18 15:42:47+00:00,2017-09-18,2017-10-05 19:30:00+00:00,2017-10-05,,Synopsis Solicitation,SBA,488190,Other Support Activities for Air Transportation,J,"Maint, Repair, Rebuild Equipment",,Jason L Wilking,Jason.L.Wilking@aphis.usda.gov,612-336-3210,,,,,,,TBD,,TBD,KY,TBD,USA,,,,,,,,,,,,,,Procurement Branch,79a43ad9a7484a7ad26e8ad9f8a62cd9,PI33_DR_IAE_51681,Jason.L.Wilking@usda.gov,2018-01-25 18:14:40+00:00,2017-09-18 15:42:47+00:00,https://www.highergov.com/contract-opportunity/AG-6395-S-17-0183-Combined_Synopsis_Solicitation-62cd9,https://sam.gov/opp/79a43ad9a7484a7ad26e8ad9f8a62cd9/view
