Notice ID,Solicitation ID,Solicitation Title,Description Text,Agency Name,Posted Timestamp,Posted Date,Response Timestamp,Response Deadline,Response Timezone,Opportunity Type,Set Aside Code,NAICS,NAICS Title,PSC,PSC Description,Primary Contact Title,Primary Contact Name,Primary Contact Email,Primary Contact Phone,Primary Contact Fax,Secondary Contact Title,Secondary Contact Name,Secondary Contact Email,Secondary Contact Phone,Secondary Contact Fax,Place of Performance Street Address,Place of Performance Street Address2,Place of Performance City,Place of Performance State,Place of Performance Zip,Place of Performance Country Code,Place of Performance Country,Related Opportunity Id,Award Date,Award Amount,Award Number,Delivery Order Number,Award Justification,Awardee Name,Awardee UEI,Awardee CAGE Code,Awardee Line Item,FPDS Code,FPDS Org ID,SAM Organization Name,Parent Opportunity ID,Modified By,Created By,Modified Timestamp,Created Timestamp,Site Page,Source Website
30b29c31c39c41e4b233437b4e7dbb92,M6700122Q1169,Refueling Ladder,"See solicitation for details

See SF30 Amendment 0001 for details
",Marine Corps Installations - East,2022-08-30 16:51:33.279000+00:00,2022-08-30,2022-09-06 16:00:00+00:00,2022-09-06,America/New_York,Solicitation,SBA,336413,Other Aircraft Parts and Auxiliary Equipment Manufacturing ,1730,Aircraft Ground Servicing Equipment,,Rebecca Hayes,Rebecca.l.hayes@usmc.mil,9104511769,,,John Hounshell,john.hounshell@usmc.mil,9104511256,,,,Beaufort,SC,29904,USA,UNITED STATES,,,,,,,,,,,1700,M67001,COMMANDING GENERAL,7c07e51699a04de482c65c4704ab5f8e,rebecca.l.hayes@usmc.mil,rebecca.l.hayes@usmc.mil,2022-08-30 16:51:33.286000+00:00,2022-08-30 16:44:46.052000+00:00,https://www.highergov.com/contract-opportunity/M6700122Q1169-Solicitation-b5f8e,https://sam.gov/opp/30b29c31c39c41e4b233437b4e7dbb92/view
24999ebf17d64f318160261e1bcb78ff,CM21060003,CM21060003 2 NIINs-Hydro Aire Inc-SS,"This is the posting of the redacted J&amp;A.
",DLA Land and Maritime,2022-08-29 12:42:28.610000+00:00,2022-08-29,,,,Justification,,336413,Other Aircraft Parts and Auxiliary Equipment Manufacturing ,1630,Aircraft Wheel and Brake Systems,,Norma Brookins,norma.brookins@dla.mil,(614)692-3579,,,,,,,,,,OH,43213,USA,,c5206bf1c8124c08b57daf1cb4a8a858,2022-08-19,,SPE7MXD5036,,far13,,,,,97AS,SPM7MX,DLA LAND AND MARITIME SUPPLIER,24999ebf17d64f318160261e1bcb78ff,norma.riveracortes@dla.mil,norma.riveracortes@dla.mil,2022-08-29 12:42:28.617000+00:00,2022-08-29 12:38:50.075000+00:00,https://www.highergov.com/contract-opportunity/CM21060003-Justification-b78ff,https://sam.gov/opp/24999ebf17d64f318160261e1bcb78ff/view
be94f0ff4f6740ecbdf7126b96944b4e,FA863721R0001,Lebanon A-29 GPS Interface Modification,"Lebanon A-29 GPS Interface Modification

Solicitation Number:

Notice Type: Sources Sought

Posted Date: 26 Feb 2021

Response Date: 15 days

Set Aside: N/A

Classification Code: 336411- Aircraft Manufacturing

NAICS Code: 336411 - Aircraft conversions

Agency: Department of the Air Force

Office: Air Force Life Cycle Management Center (AFLCMC)/ Fighters and Advanced Aircraft Directorate (WAB) Location: Wright-Patterson Air Force Base, Ohio

Interested vendors are encouraged to check this site often to view any updates and additions. The Government is interested in providing as much information as possible to interested vendors. If there is a particular document or specific information an interested vendor would like to see included in the Bidder&#39;s Library, please send that request to the Points of Contact identified herein.



PLEASE NOTE: THE GOVERNMENT IS NOT SOLICITING PROPOSALS AT THIS TIME. NO CONTRACT WILL RESULT FROM THIS POSTING.



1.0 DESCRIPTION:

This is a SOURCES SOUGHT SYNOPSIS (SSS) in accordance with Federal Acquisition Regulation (FAR) 5.2. Responses to this notice are not offers and cannot be accepted by the United States Government (USG) to form a binding contract. The USG is conducting market research to identify, as potential sources and subcontracting opportunities, firms that may possess the expertise, capabilities, experience and necessary data to competently and competitively respond to all requirements to provide Lebanon A-29 GPS Modification for a Foreign Military Sales Program (FMS) with the Lebanon Armed Forces (LAF). The level of security clearance and amount of foreign participation in this acquisition has not been determined.

1.1 BACKGROUND:


	The Lebanon A-29 program is an FMS program executed and funded by a Letter of Acceptance (LOA).  This requirement is a line item on a current FMS LOA.
	The Lebanon A-29 program is seeking to implement  onboard GPS signal acquisition integration/improvements, which may interface with one or more of the already installed GPS sources on the A-29 Lebanon platform
	The Lebanon Armed Forces (LAF) aircraft, designated as the A-29 Lebanon aircraft, is a non-developmental aircraft procured from Sierra Nevada Corporation (SNC). SNC is presently subcontracting to Embraer, who is the Original Equipment Manufacturer (OEM) for their A-29 Super Tucano aircraft.
	The Lebanon aircraft is a single-engine, turboprop, fixed-wing aircraft, with tricycle style, retractable landing gear, tandem two-place pressurized cockpit with ejection seats, capable of operating from semi-prepared air fields and employing various munitions from North Atlantic Treaty Organization compatible hard points.
	The scope of this effort is to integrate the Novatel GAJT-AE-N-PS equipment and associated antenna, as provided by the USG, to interface with the onboard A-29 Lebanon equipment and systems.  Technical manuals and airworthiness certification documentation updates may be required based on the design and modification of the A-29 Lebanon aircraft.  A Service Bulletin may be required to implement required changes to the A-29 Lebanon aircraft, and to update the Aircraft Specification, Computer Based Trainer (CBT) specification, and other contract documents.


1.2 REQUIREMENTS:

The contractor, in its response, shall provide information concerning its expertise and capabilities for the potential integration of a Novatel GAJT-AE-N-PS solution, as furnished by the US Government, onto the A-29 Lebanon aircraft. The effort includes detailed integration, test, certification, training, and updating of technical manuals and other required documentation for modification of the A-29 Lebanon with the GPS  interfacing system.  Additionally, the effort shall support validation and verification testing of the solution with the Air Force Research Laboratory (AFRL, Wright Patterson Air Force Base, Dayton, Ohio) to include A-29 technical data, GPS subsystems data, proposed solution technical data, integration of proposed solution and other support required to permit successful test completion with AFRL.

 TASKS:  Integrate the USG-provided Novatel GAJT-AE-N-PS GPS interfacing equipment and associated antenna to connect with GPS and other A-29 subsystems.


	The integration and installation of the USG-directed GPS interfacing solution shall occur in Lebanon with the LAF maintainers providing primary hands on installation labor
	The Novatel GAJT-AE-N-PS  and applicable antenna will be provided as Government Furnished Equipment (GFE)
	Consider and recommend rapid integration and provide timing for delivery and rapid fielding of  the solution
	Identify any impacts/considerations to interfaces and impacted subsystems as a result of the integration
	Recommend appropriate Design Reviews and Configuration Audits as well as a Modification Planning Review as part of this effort
	Develop a change specific certification plan and a draft Modified Airworthiness Certification Criteria (MACC) in accordance with MIL-HDBK-516C.  Identify airworthiness certification impacts for integration of the GPS interfacing solution.  Generate all necessary airworthiness certification required products for compliance assessment IAW MIL-HDBK-516C
	Identify hardware/wiring &amp; potential affected software requirements for any integration required to implement the solution
	Identify changes to current Initial Capabilities Document (ICD)
	Identify A-29 integration constraints, including (but limited to) space limitations, structures, flying qualities, EMI/EMC, and electrical loads
	Identify any applicable impacts to any identified impacted systems, which could include A-29 Aircraft OFP, GPS software/firmware, or other subsystems
	As required and/or requested, sponsor a technical interchange meeting (TIM) with AFRL to ensure that successful virtual testing is supported. Assure required contractor involvement/tech support at any AFRL test event
	As required, sponsor Technical Interchange Meetings (TIMs), with with USG and USG-provided equipment manufacturers, to facilitate tech data interchange for integration
	Identify any A/C assets or subsystems required to test and install this modified integrated GPS solution
	Identify, report, and draft technical publications changes required to implement the integrated solution
	Identify, report, and draft required sustainment tasks and procedures to operate and maintain the integrated solution
	Submit an Engineering Change Proposal (ECP) with costs that can be implemented in Lebanon using LAF direct labor.  The ECP would be issued under a Contract Data Requirements List (CDRL)
	Development of a Service Bulletin based upon the approved USG Configuration Control Board (CCB)
	Provide applicable/required airworthiness artifacts identified by Airworthiness Determination Form (ADF) and Certification Basis to support USAF airworthiness certification for the integration of the USG-furnished equipment and associated antenna
	Provide acquisition and shipment to Lebanon of all hardware, software and SB installation kit to accomplish OCONUS field installations (other than GFE supplied Hardware)
	Provide a field service team, in Lebanon, to assist the Lebanon Armed Forces maintainers to complete the OCONUS aircraft modifications and associated post-mod ground testing in Lebanon.


2. CAPABILITY SURVEY:

2.1 Company Response


	Both large and small businesses are encouraged to participate in this market research. The results of this market research will allow the USG to make a determination as to whether this effort will be a sole source, full and open, full and open after exclusion of sources, or small business set-side acquisition. It is advised that you provide a sufficient response to all capability questions to allow the USG to appropriately assess your capabilities.
	Any information submitted by respondents to this SSS is strictly voluntary. This SSS does not constitute a RFP or an Invitation for Bid. SSS issuance does not restrict the USG&#39;s ultimate acquisition approach. The USG will neither award a contract solely on the basis of this notice, nor pay for any information that is submitted by respondents to this SSS.
	Direct and concise responses are required and should clearly demonstrate your ability to meet the stated requirements. Recent relevant experience in all areas should be provided. Teaming and/or subcontracting arrangements, including joint ventures, should be clearly delineated  and previous experience in teaming must be provided. Marketing material is considered an insufficient response to this SSS.


2.2 Business Information

In response to this SSS, please provide the following business information for your company/institution and for any teaming or joint venture partners:


	
	
		
		
			Company/Institute Name:
			Address:
			Point of Contact:
			Commercial and Government Entity (CAGE) Code:
			Phone Number:
			E-mail Address:
			Web Page URL:
			Size of business pursuant to North American Industry Classification System (NAICS) Code: 336411. Size standard: $32.5M. Based on this NAICS Code, state your company business size. If you are a Small Business (SB, WOSB, EDWOSB, SOB, 8(a), HUBZone, VOSB, SDVOSB), please explain whether your company would be capable of meeting the requirements of FAR 52.219-14, Limitations on Subcontracting.
			Small Business (Yes/ No)
			Woman Owned Small Business (Yes / No)
			Small Disadvantaged Business (Yes / No)
			Economically Disadvantaged Women-Owned Small Business (Yes / No)
			Disadvantaged Women-Owned Small Business (Yes / No)
			8(a) Certified (Yes / No)
			HUBZone Certified (Yes / No)
			Veteran Owned Small Business (Yes / No)
			Service Disabled Veteran Owned Small Business (Yes / No)
			Large Business (Yes / No)
			System for Award Management (SAM) Registered (Yes / No)
		
		
	
	


All prospective contractors must be registered in the SAM database to be awarded a DoD contract. The Government believes the NAICS code for this acquisition is 336411. If you do not agree, please suggest a NAICS code and provide your rationale. The NAICS code for this requirement, if applicable to the company&#39;s capabilities, should be included in the company&#39;s NAICS code listing in SAM.

2.3 General Capability:


	Describe briefly the elements of your company and the nature of the goods and/or services you provide. Include a description of your staff composition and management structure.
	Describe your company&#39;s past experience on previous projects (no more than five examples) similar in purpose and/or complexity to this requirement. Include contract numbers, a brief description of the work performed, period of performance, agency/organization supported, and individual points of contact (Contracting Officer or Program Manager). Include your company&#39;s responsibility/role as a prime and/or subcontractor on each of these projects.
	Describe your specific capabilities of working with Foreign Military Sales (FMS) contracts in the past and registration with the U.S Department of State for import and export of materials.
	Describe your experience with supporting aircraft in accordance with Federation Aviation Administration (FAA), or equivalent requirements and providing support personnel who are FAA-certified (or equivalent).
	Describe any other relevant topics, concerns, and information that will help the USG in forming an acquisition strategy.


3.0 ADMINISTRATION


	An Ombudsman has been established for this acquisition. The only purpose of the Ombudsman is to receive and communicate serious concerns from potential offerors when an offeror prefers not to use established channels to communicate concerns during the proposal development phase of this acquisition. Potential sources should use established channels to request information, pose questions, and voice concerns before resorting to use of the Ombudsman. Potential sources are invited to contact AFLCMC&#39;s Ombudsman with serious concerns only:


Col Sean Tucker,                   

AFLCMC/AQ 1790 10th Street

Wright-Patterson AFB, OH 45433-7630

Tel: 937-785-5512

Fax: 937-785-7916

sean.tucker.1@us.af.mil


	Interested parties who believe they can provide the required Lebanon A-29 GPS interface integration solution may respond by submitting their response to the above questions in paragraphs 2.2, Business Information and paragraph 2.3, General Information, via email. Written responses to this synopsis shall contain sufficient documentation to establish a bona fide capability to fulfill this requirement. The intent of this notice is not a request for competitive proposals. Please submit all responses related to this notice, via email, to cassi.ballinger@us.af.mil by 4:00 PM (EST) 15 days after the release of this document.
	The USG does not intend to award a contract on the basis of this SSS or to otherwise pay for the information solicited except as an allowable cost under other contracts as provided in subsection FAR 31.205-18, Bid and Proposal costs, of the FAR. Companies responding to this SSS are advised that participation does not ensure involvement in future solicitations or contract awards. The USG shall not reimburse any company or individual for any expenses associated with preparation or participation in this SSS. Respondents are solely responsible for all expenses associated with responding to this SSS.
	A point of contact that can speak for the responding company should be identified to support further USG inquiries as well as explanations that might be needed with regard to the information provided.
	Written responses to this synopsis shall contain sufficient documentation to establish a bona fide capability to fulfill this requirement. The intent of this notice is not a request for proposal. Responses shall be limited to 25 pages, 8.5&quot;x 11&quot;pages, in English, 12 point font, Times New Roman, and 1 inch margins. The response shall be provided in searchable ADOBE ACROBAT (.pdf) format.


4.0 Contracting Office Address:

Attn: Kimberly Conley &ndash; Building 556

2275 D Street

Wright-Patterson AFB, Ohio 45433-7218 United States

kimberly.conley.3@us.af.mil



5.0 Potential Places of Performance: 

Hamat Air Base, Lebanon

Beirut Lebanon
",AFLCMC Wright Patterson AFB,2021-02-26 15:27:44.788000+00:00,2021-02-26,2021-03-13 21:00:00+00:00,2021-03-13,America/New_York,Sources Sought,,336411,Aircraft Manufacturing ,,,,Kimberly Conley,kimberly.conley.3@us.af.mil,,,,Cassi Ballinger,cassi.ballinger.1@us.af.mil,,,,,Hamat Air Base,,,LBN,LEBANON,,,,,,,,,,,5700,FA8637,FA8637 AFMC AFLCMC/WWB,be94f0ff4f6740ecbdf7126b96944b4e,kestin.howard@us.af.mil,kimberly.conley.3@us.af.mil,2021-03-16 03:55:54.612000+00:00,2021-02-26 13:05:20.209000+00:00,https://www.highergov.com/contract-opportunity/FA863721R0001-Sources_Sought-44b4e,https://sam.gov/opp/be94f0ff4f6740ecbdf7126b96944b4e/view
20b3dbdac96540e8950f1f516fc1a8f5,451599,Aerodynamic Flow Field and Load Calculations,"SOURCES SOUGHT
 Aerodynamic Flow Field and Load Calculations
Background
Pacific Northwest National Laboratory&rsquo;s (PNNL) Atmospheric Radiation Measurement (ARM) Aerial Observation Capability (Air-ARM) project is evaluating aircraft to replace the Gulfstream G-159 (G-1) aircraft used to support the US Department of Energy (DOE) ARM Aerial Facility (AAF).
The Bombardier CRJ-200, Q200, Q300, ATR-42, and Embraer ERJ-135 are the aircraft that potentially meet the requirements of the Air-ARM project.
Once a replacement aircraft is acquired it will be modified for atmospheric research. The modifications will likely include installation of under-wing mounted pylons, fuselage mounted pylons, and window pass throughs/attachment points. Free airstream sensors will be mounted onto the pylons and window attachment points.
For examples see https://www.flickr.com/photos/armgov/albums/72157623918331175.
Scope Description
Free airstream sensors need to be mounted in locations where flow disturbances are minimal and/or well characterized. To this end, aerodynamic flow field calculations shall be carried out for the aircraft above applicable to a range of airspeeds and various angles of attack. 
Once optimal locations for free airstream sensors has been determined, aerodynamic loads shall be calculated for attachments, pylons and idealized shapes of the free airstream sensors. The load calculations shall be performed for a range of airspeeds and angles of attack.
If you are interested, please email the following information to PNNL by 10:00 a.m. PST, Monday, March 15, 2018:
&middot;       Demonstrated experience for all elements in the Scope Description above.&middot;       Your Name&middot;       Company Name&middot;       Full Mailing Address&middot;       Phone Number&middot;       Email Address&middot;       State business size:  Small or Large 
Send to: 
Julie Hughes, Acquisition Team Lead 
509-371-7202 
julie.hughes@pnnl.gov
 
We will contact you when we are ready to issue an RFP.  We look forward to hearing from you.
 ",Office of Science,2018-03-08 17:37:50+00:00,2018-03-08,2018-03-17 04:59:00+00:00,2018-03-17,,Sources Sought,,336411,Aircraft Manufacturing ,15,Aerospace Craft And Structural Components,Acquisition Team Lead,Julie Hughes,julie.hughes@pnnl.gov,5093717202,,,,,,,,,,,,,,,,,,,,,,,,,,PNNL Contracts,20b3dbdac96540e8950f1f516fc1a8f5,PI33_DR_IAE_51681,julie.hughes@pnnl.gov,2018-03-31 08:41:11+00:00,2018-03-08 17:34:49+00:00,https://www.highergov.com/contract-opportunity/451599-Sources_Sought-1a8f5,https://sam.gov/opp/20b3dbdac96540e8950f1f516fc1a8f5/view
023c5fc673ac59edbd7bee17d7aeffe4,FA8637-13-D-6003,"REQUEST FOR INFORMATION: Notice of Intent to Extend Light Air Support (LAS) Indefinite Delivery, Indefinite Quantity (IDIQ) Contract","REQUEST FOR INFORMATION  
The Air Force Life Cycle Management Center, Wright-Patterson AFB, Ohio contemplates an extension to the period of performance and ceiling of contract FA8637-13-D-6003 with the Sierra Nevada Corporation (SNC), 444 Salomon Circle, Sparks, NV  89434-9651, currently set to expire 26 February 2019.  Under the LAS IDIQ contract, Sierra Nevada Corporation acquired LAS A-29 aircraft and associated support for the Afghanistan Air Force (AAF) as part of the Building Partnership Capacity (BPC) program with the Government of the Islamic Republic of Afghanistan (GIRoA).  This includes aircraft Interim Contractor Support (ICS), Ground Training Devices (GTDs) and corresponding Contractor Logistics Support (CLS); and Air Advisor Training for US personnel allowing them to train AAF personnel.  The prime contractor, SNC, has delivered twenty (20) aircraft and is producing six (6) additional aircraft.  Of the delivered aircraft, twelve (12) are in AAF combat operations against enemy combatants.   The contractor provides all maintenance support necessary for both on-going training and combat operations at two operating locations; Moody AFB, Georgia and Kabul, Afghanistan.
The current contract permits the Government to issue orders on or before five years from the 27 February 2013 award of the Basic Contract.  Performance of services under any order issued during the ordering period shall be completed not later than 26 February 2019.
This action will extend the current contract ordering period eighteen (18) months to continue support of the Afghanistan BPC mission during the development of a subsequent support contract.  
The extension contemplated is pursuant to 10 U.S.C. 2304(c)(1), as implemented by FAR 6.302-1(a)(2), Only One Responsible Source and No Other Supplies or Services Will Satisfy Agency Requirements. Due to the complex nature of this effort, the highly specialized equipment and services involved, and the relationship with the principle subcontractor, Embraer Defense Systems International (EDSI), the government anticipates SNC is the only responsible source for the extension of these services
Industry representatives with comments regarding the contemplated extension or qualification/capability assertions shall submit them to Audra Dorn (audra.dorn.3@us.af.mil) on or before 19 January 2018, 3:00 PM Eastern Daylight Time (EDT).   ",AFLCMC Wright Patterson AFB,2018-01-04 20:10:49+00:00,2018-01-04,2018-01-19 20:00:00+00:00,2018-01-19,,Special Notice,,336411,Aircraft Manufacturing ,15,Aerospace Craft And Structural Components,,Audra L. Dorn,audra.dorn.3@us.af.mil,,,,Katie E. Fecher,katie.fecher@us.af.mil,,,,,,,,,,,,,,,,,,,,,,"AFLCMC/PK - WPAFB (includes  PZ, WL, WW, WI, WN, WK, LP, WF, WK)",e117641baf03014c58cd7f92c2ce24d3,PI33_DR_IAE_51681,,2018-02-03 09:39:36+00:00,2018-01-04 20:10:49+00:00,https://www.highergov.com/contract-opportunity/FA8637-13-D-6003-Special_Notice-e24d3,https://sam.gov/opp/023c5fc673ac59edbd7bee17d7aeffe4/view
