9f959d4fa7592b0978360c169c487009,DJM-17-A37-Q-0174,Purchase/Lease Aircraft,"REQUEST FOR INFORMATION / SOURCES SOUGHT NOTICE
The U.S. Marshals Service (USMS), Justice Prisoner and Alien Transportation System (JPATS), Las Vegas, Nevada operational site, is seeking information from responsible sources and commercial agencies concerning the purchase OR ""dry"" lease (aircraft, insurance, maintenance, and logistics support services) of one (1) large transport category turbine powered aircraft to fulfill its unique mission objectives. JPATS has determined the following aircraft types meet their need: Bombardier CRJ700 ER, Bombardier CRJ900 NextGen LR, Bombardier CRJ1000 NextGen ER, Embraer 170, Embraer 175, and Embraer 190.
Specific Aircraft Requirements:
Aircraft must have U.S. registry with valid FAA issued standard Certificate of Airworthiness, approximately 70-99 coach seats, transport category, single aisle interior, self-contained main entry door air stairs, and be equipped with an APU suitable for providing ground power self-contained engine starts.
Other Aircraft Requirements:
Aircraft and engines are required to be delivered with all applicable FAA Airworthiness Directives and Manufactures Mandatory Service Bulletins complied with, fresh heavy check (applicable to that aircraft's approved maintenance and inspection program), and no calendar maintenance or inspection events due the first 12 months; engine life limited components at ""half-life""; engines enrolled (or eligible for enrollment) in a Power-by-the-Hour maintenance program; and landing gear at ""half-life"". JPATS anticipates utilizing the aircraft approximately 900 hours (450 cycles) annually.
Maintenance Requirements: All maintenance requirements will be in accordance with manufacture requirements and FAA Regulations (ADs, SBs, etc.) to meet Title 14 CFR Part 91.
Strategy Option One:
Provide information and availability for the purchase of one (1) aircraft meeting the above requirements. Include details of all aircraft available and the approximate price of these aircraft.
Strategy Option Two:
Provide information and availability for the ""dry"" lease (aircraft, insurance, maintenance) of one (1) aircraft meeting the above requirements including all maintenance and logistics support services for a period of one (1) year with four (4) option years. Include details of all aircraft available and approximate monthly leasing cost (which would include the aircraft and all maintenance &amp; logistics support). Submitting information does not bind the Government for any future contracts resulting from this RFI/SSN. The findings from this Market Research effort may impact future solicitations related to this requirement. This RFI/SSN is not a solicitation or Request for Proposal as defined by FAR 2.101, and the Government is not requesting offers or proposals at this time. Any responses to this RFI/SSN will not be accepted to form a binding contract. This is a market survey for planning purposes and no award will be made as a result of this. If a solicitation is issued, the Government does not guarantee that it will be issued to RFI/SSN respondents. The Government may use the information provided to develop a comprehensive acquisition strategy and solicitation. Responses shall not include proprietary information.
The Government is interested in feedback from the commercial market on the requirements listed in this RFI/SSN that may be available. Vendors are asked to respond with documentation outlining their capabilities and provide feedback on the capabilities listed within this RFI/SSN.
The Government would like to see proposed capabilities, concepts or feedback presented through capabilities packages, drawings / pictures, spec sheets, websites, certificates or PowerPoint briefs.
In addition to submitting your information / capabilities and/or feedback, please respond to the following questions:
1. Is your firm registered in the System for Award Management (SAM)? In accordance with federal regulations, all contractors doing business with the federal government must be registered in the SAM database.
2. Based on the NAICS code 488190 - Aircraft Manufacturing, with an associated Small Business Administration (SBA) size standard of 1,500 employees, what is your business size, small or large?
3. Based on the NAICS code 488190 - Other Support Activities for Air Transportation, with an associated Small Business Administration (SBA) size standard of $32.5 million, what is your business size, small or large?
4. Within the past 5 years, have you provided similar services with commercial entities, federal, state or local governments? If so, please describe and include a) the contract number, dollar value, period of performance and current status of the contract. b) the types of aircraft provided; c) where the planes were maintained; d) the extent of the maintenance; e) any subcontractors used on the project and their respective roles on the project.
5. If awarded a contract, how many calendar days after award would you need to present the required aircraft for purchase? How many calendar days would you need to begin providing the leased aircraft along with all the maintenance and logistics support services?
An acquisition strategy is being developed and a contract may or may not result. Market research is being conducted to determine the interest and capability of potential sources for this requirement. Funding is not available for any information submitted.All information submitted in response to this announcement is voluntary, the government will not pay for information requested, nor will it compensate any respondent for any cost incurred in developing information provided to the government.
If information or capabilities packages are not received from at least two capable small business concerns by the response date or if the Government determines that no small businesses are capable of performing this requirement based upon an evaluation of the capabilities packages and information submitted; this requirement may be solicited under an unrestricted basis.
Capabilities packages, information and/or any feedback shall be submitted (via e-mail) to the POC listed below not later than 12:00 pm (noon) CT, February 15, 2017. Any questions concerning this announcement shall be in writing (e-mail) to the POC listed below. No telephone calls will be accepted.
POC: Victor J. Stamps, Contracting Officer, USMS/JPATS, e-mail address: victor.j.stamps@usdoj.gov",USMS Justice Prisoner and Alien Transportation System,2017-02-03 18:07:12+00:00,2017-02-03,2017-02-15 18:00:00+00:00,2017-02-15,,Sources Sought,,488190,Other Support Activities for Air Transportation,15,Aerospace Craft And Structural Components,,Victor J. Stamps,Victor.J.Stamps@usdoj.gov,816/467-1996,816/467-1982,,,,,,"United States Marshals Service
Justice Prisoner & Alien Transportation System
C/O Atlantic Aviation
275 East Tropicana Ave.
",,LAS VEGAS,NV,89169,USA,,,,,,,,,,,,,,Justice Prisoner Alien Transportation Division,9f959d4fa7592b0978360c169c487009,PI33_DR_IAE_51681,Victor.J.Stamps@usdoj.gov,2017-08-15 08:37:17+00:00,2017-02-03 18:07:12+00:00,https://www.highergov.com/contract-opportunity/DJM-17-A37-Q-0174-Sources_Sought-87009,https://sam.gov/opp/9f959d4fa7592b0978360c169c487009/view
56d3315b4f2a04e149afcd7ce515779b,FA8637A-29Production ,Production of Four A-29 Light Air Support Aircraft (LAS) for the Afghanistan Air Force (AAF),"Agency: Department of the Air ForceOffice: Air Force Life Cycle Management Center (AFLCMC)/Development &amp; Integration (WWB)Location: Wright-Patterson Air Force Base, OhioInterested vendors are encouraged to check this site often to view any updates and additions. The Government is interested in providing as much information as possible to interested vendors. If there is a particular document or specific information an interested vendor would like to see included in the Bidder's Library, please send that request to the Points of Contact identified herein.PLEASE NOTE: THE GOVERNMENT IS NOT SOLICITING PROPOSALS AT THIS TIME. NO CONTRACT WILL RESULT FROM THIS POSTING.1.0 DESCRIPTION:This is a SOURCES SOUGHT SYNOPSIS (SSS) in accordance with Federal Acquisition Regulation (FAR) 5.2. Responses to this notice are not offers and cannot be accepted by the United States Government (USG) to form a binding contract. The USG is conducting market research to identify, as potential sources and subcontracting opportunities, firms that may possess the expertise, capabilities, experience and necessary data to respond to all requirements to provide additional production of four Light Air Support (LAS) A-29 Aircraft for a Building a Partnership Capacity Program for the Afghanistan Air Force (AAF). In accordance with Buy American Act, the end-product must be manufactured in the United States.1.1 BACKGROUND:&bull; The LAS aircraft, designated as the A-29 LAS aircraft, is a non-developmental aircraft currently procured from Sierra Nevada Corporation (SNC). SNC is presently subcontracting to Embraer, who is the Original Equipment Manufacturer (OEM) for their A-29 Super Tucano aircraft. The LAS aircraft mission includes conducting advanced flight training, surveillance, air interdiction, and close air ground support.&bull; The LAS aircraft is a single-engine, turboprop, fixed-wing aircraft, with tricycle style, retractable landing gear, tandem two-place pressurized cockpit with ejection seats, capable of operating from semi-prepared air fields and employing various munitions from North Atlantic Treaty Organization compatible hard points. &bull; The aircraft capabilities include external hard points to support an Electro-Optic Infrared (EO-IR) Sensor, external fuel tanks, and external munitions. This aircraft also supports day time Visual Flight Rules/Instrumentation Flight rules operation.&bull; SNC currently supports the LAS aircraft production and all maintenance/supply requirements for the aircraft, Ground Training Devices (GTDs), and associated support equipment for LAS operations; therefore, the additional four aircraft must be compatible with the current configuration of both the aircraft and GTDs. &bull; Contract period of Performance (PoP) is anticipated not to exceed 18-20 months. 1.2 REQUIREMENTS:The Contractor shall provide four production Light Air Support (LAS) A-29 Aircraft in the latest configuration with all required data and support equipment within 18-20 months from contract award. Any qualified sources must have in-depth knowledge of the A-29 aircraft and have the existing capability to perform all of the stated requirements at the time of contract award. The Contractor shall be able to maintain continuity of operations, avoid risk of a split fleet, and establish a contractual relationship with the OEM to ensure modification of the aircraft to its latest approved configuration, as to avoid the negative impacts of a multi-configured fleet. SNC is responsible for maintaining a Fully Mission Capable (FMC) rate of 80% for the entire fleet (to include the four additional aircraft); therefore, any qualified source must also establish a contractual relationship with SNC. Until aircraft are transitioned to USG/SNC, the Contractor shall be responsible for: 1) Procurement of four A-29 LAS aircraft built in the United States, to include applicable alternate mission equipment (AME)2) Functional Check Flight (FCF)/acceptance of aircraft from U.S. manufacturer3) Delivery of aircraft to Moody AFB. 4) Packing, handling, shipping and transportation of associated AME to Moody AFB.5) Ensuring configuration management of aircraft hardware and software match current A-29 aircraft and A-29 GTD configurations, to include ensuring current A-29 LAS technical manuals fully support aircraft produced. 6) Program management and site management 7) Contract quality administration 8) Sustainment of each aircraft until such time as they are DD250/transferred to theUSG, which would include: Field team support, aircraft maintenance, engineering services (including airworthiness, technical support, and aircraft modifications), and Contract Deliverables Requirements List (CDRLs)
&bull; All parts are subject to State Department/ITAR import and export approval. The Contractor shall be responsible for import and export licenses, technical assistance agreements, and approvals. &bull; The Contractor shall implement procedures to protect Critical Program Information (such as proprietary data), systems, and components. &bull; Embraer, the A-29 OEM, owns all technical data and software relevant to the A-29 aircraft. No data is anticipated to be purchased by the program office at this time.
2. CAPABILITY SURVEY:2.1 Company Response&bull; Both large and small businesses are encouraged to participate in this market research. The results of this market research will be used to assess whether this effort will be a sole source, full and open, full and open after exclusion of sources, or small business set-side acquisition. It is advised that you provide a sufficient response to all capability questions to allow the USG to appropriately assess your capabilities. &bull; Any information submitted by respondents to this SSS is strictly voluntary. This SSS does not constitute a RFP or an Invitation for Bid. SSS issuance does not restrict the USG's ultimate acquisition approach. The USG will neither award a contract solely on the basis of this notice, nor pay for any information that is submitted by respondents to this SSS.&bull; Direct and concise responses are required and should clearly demonstrate your ability to meet the stated requirements. Recent relevant experience in all areas should be provided. Teaming and/or subcontracting arrangements, including joint ventures, should be clearly delineated and previous experience in teaming must be provided. Marketing material is considered an insufficient response to this SSS.2.2 Business InformationIn response to this SSS, please provide the following business information for your company/institution and for any teaming or joint venture partners:&bull; Company/Institute Name:&bull; Address:&bull; Point of Contact:&bull; Commercial and Government Entity (CAGE) Code:&bull; Phone Number:&bull; E-mail Address:&bull; Web Page URL:&bull; Size of business pursuant to North American Industry Classification System (NAICS) Code: Aircraft Manufacturing - 336411; Size standard: 1,500 employees. Based on this NAICS Code, state your company business size. If you are a Small Business (SB, WOSB, EDWOSB, SOB, 8(a), HUBZone, VOSB, SDVOSB), please explain whether your company would be capable of meeting the requirements of FAR 52.219-14, Limitations on Subcontracting.&bull; Small Business (Yes/ No)&bull; Woman Owned Small Business (Yes / No)&bull; Small Disadvantaged Business (Yes / No)&bull; Economically Disadvantaged Women-Owned Small Business (Yes / No)&bull; Disadvantaged Women-Owned Small Business (Yes / No)&bull; 8(a) Certified (Yes / No)&bull; HUBZone Certified (Yes / No)&bull; Veteran Owned Small Business (Yes / No)&bull; Service Disabled Veteran Owned Small Business (Yes / No)&bull; Large Business (Yes / No)&bull; System for Award Management (SAM) Registered (Yes / No)All prospective contractors must be registered in the SAM database to be awarded a DoD contract. The Government believes the NAICS code for this acquisition is 336411. If you do not agree, please suggest a NAICS code and provide your rationale. The NAICS code for this requirement, if applicable to the company's capabilities, should be included in the company's NAICS code listing in SAM.2.3 General Capability:&bull; Describe briefly the elements of your company and the nature of the goods and/or services you provide. Include a description of your staff composition and management structure.&bull; Describe your company's past experience on previous projects (no more than five examples) similar in purpose and/or complexity to this requirement. Include contract numbers, a brief description of the work performed, period of performance, agency/organization supported, and individual points of contact (Contracting Officer or Program Manager). Include your company's responsibility/role as a prime and/or subcontractor on each of these projects..&bull; Describe your company's previous experience with the process of USAF military type certification. &bull; Describe your company's previous experience with production of Light Air Support (LAS) A-29 Aircraft. &bull; Describe your approach to establish and maintain agreements with the OEMs and vendors for data and technical support to maintain the LAS aircraft. Also describe successes working with data and technical support with foreign OEMs.&bull; Describe your specific capabilities of working with Foreign Military Sales (FMS) contracts in the past and registration with the U.S Department of State to work with the country of Afghanistan for import and export of materials&bull; Describe any other relevant topics, concerns, and information that will help the USG in forming an acquisition strategy.&bull; Are there any commercial business practices unique to your industry/company? If so, please describe. Please specify if you intend to propose, either whole or in part, a commercial solution.&bull; A plan for acquisition of requisite technical data and equipment in order to provide four A-29 aircraft in the latest configuration within 18-20 months of contract award.
3. ADMINISTRATION&bull; An Ombudsman has been established for this acquisition. The only purpose of the Ombudsman is to receive and communicate serious concerns from potential offerors when an offeror prefers not to use established channels to communicate concerns during the proposal development phase of this acquisition. Potential sources should use established channels to request information, pose questions, and voice concerns before resorting to use of the Ombudsman. Potential sources are invited to contact AFLCMC's Ombudsman with serious concerns only:Lt Col Kenneth L. Decker, AFLCMC/AQ1790 10th StreetWright-Patterson AFB, OH 45433-7630Tel: 937-785-5512Fax: 937-785-7916kenneth.decker.1@us.af.mil&bull; Interested parties who believe they can provide the required LAS aircraft may respond by submitting their response to the above questions in paragraphs 2.2, Business Information and paragraph 2.3, General Information, via email. Written responses to this synopsis shall contain sufficient documentation to establish a bona fide capability to fulfill this requirement. The intent of this notice is not a request for competitive proposals. Please submit all responses related to this notice, via email, to abby.kaelin@us.af.mil by 2:00 PM (EST) by 27 October 2016.&bull; The USG does not intend to award a contract on the basis of this SSS or to otherwise pay for the information solicited except as an allowable cost under other contracts as provided in subsection FAR 31.205-18, Bid and Proposal costs, of the FAR. Companies responding to this SSS are advised that participation does not ensure involvement in future solicitations or contract awards. The USG shall not reimburse any company or individual for any expenses associated with preparation or participation in this SSS. Respondents are solely responsible for all expenses associated with responding to this SSS.&bull; A point of contact that can speak for the responding company should be identified to support further USG inquiries as well as explanations that might be needed with regard to the information provided. &bull; Written responses to this synopsis shall contain sufficient documentation to establish a bona fide capability to fulfill this requirement. The intent of this notice is not a request for proposal. Responses shall be limited to 15 pages, 8.5""x 11""pages, in English, 12 point font, Times New Roman, and 1 inch margins. The response shall be provided in searchable ADOBE ACROBAT (.pdf) format.
4. Contracting Office Address: Attn: Abby Kaelin - Building 5532275 D StreetWright-Patterson AFB, Ohio 45433-7218 United States Abby.Kaelin@us.af.mil
 
 ",AFLCMC Wright Patterson AFB,2016-10-07 13:47:52+00:00,2016-10-07,2016-10-27 19:00:00+00:00,2016-10-27,,Sources Sought,,336411,Aircraft Manufacturing ,15,Aerospace Craft And Structural Components,Contracts Negotiator,Abby Kaelin,abby.kaelin@us.af.mil,937-713-7384,,Contract Negotiator,Patrice M. Richardson-Scott,patrice.richardson-scott@us.af.mil,9377137389,,"2725 C Street, Bldg. 553",,WPAFB,OH,45433,USA,,,,,,,,,,,,,,"AFLCMC/PK - WPAFB (includes  PZ, WL, WW, WI, WN, WK, LP, WF, WK)",56d3315b4f2a04e149afcd7ce515779b,PI33_DR_IAE_51681,,2016-11-11 09:38:26+00:00,2016-10-07 13:47:52+00:00,https://www.highergov.com/contract-opportunity/FA8637A-29Production-Sources_Sought-5779b,https://sam.gov/opp/56d3315b4f2a04e149afcd7ce515779b/view
