Notice ID,Solicitation ID,Solicitation Title,Description Text,Agency Name,Posted Timestamp,Posted Date,Response Timestamp,Response Deadline,Response Timezone,Opportunity Type,Set Aside Code,NAICS,NAICS Title,PSC,PSC Description,Primary Contact Title,Primary Contact Name,Primary Contact Email,Primary Contact Phone,Primary Contact Fax,Secondary Contact Title,Secondary Contact Name,Secondary Contact Email,Secondary Contact Phone,Secondary Contact Fax,Place of Performance Street Address,Place of Performance Street Address2,Place of Performance City,Place of Performance State,Place of Performance Zip,Place of Performance Country Code,Place of Performance Country,Related Opportunity Id,Award Date,Award Amount,Award Number,Delivery Order Number,Award Justification,Awardee Name,Awardee UEI,Awardee CAGE Code,Awardee Line Item,FPDS Code,FPDS Org ID,SAM Organization Name,Parent Opportunity ID,Modified By,Created By,Modified Timestamp,Created Timestamp,Site Page,Source Website
bd87b14eebce4a20a47af476c662ca03,SPE4A725R0813,"PISTON ASSEMBLY, LANDING GEAR / NSN 1620-01-089-3527 / UH-60 HELICOPTER","A 100% Small Business Set-Aside solicitation will be issued to establish an Indefinite Quantity Contract (IQC) for NSN 1620-01-089-3527, a PISTON ASSEMBLY, LANDING GEAR. The award will be for a 5-year base period. The Estimated Annual Quantity (EAQ) is 40 EACH. Production units will be FOB: Destination; Inspection /Acceptance: Origin. Item is critical and deemed a Navy Critical Safety Item. Government First Article Testing, Export Control and IUID apply. Surge does not apply.



The proposed contract action is for supplies for which the Government intends to solicit and negotiate with only one or a limited number of sources under the authority of FAR 6.302. The OEM is Sikorsky (CAGE 78286) in accordance with part number 70250-12066-041. Approved sources are GOODRICH AEROSPACE CANADA LTD. (CAGE 02121), HEROUX-DEVTEK INC. (CAGE 36164), CANADIAN COMMERCIAL CORPORATION (CAGE 98247), MACHINE SPECIALTIES, LLC (CAGE 1DDX0), NASSAU TOOL WORKS, INC (CAGE 2M490), MERRITT PREFERRED COMPONENTS INC (CAGE 2X665), ES3 PRIME LOGISTICS GROUP INC (CAGE 4JZH8), HDI LANDING GEAR USA INC (CAGE 5ZBP4), ES3 PRIME LOGISTICS GROUP, INC. (CAGE 6LKA3) and  GKN FOKKER AEROSPACE B.V. (CAGE H1632).

DLA Aviation does NOT possess technical data on this part. Any other interested contractor would have to submit a Source Approval Request (SAR) package for approval to be added as a source by the assigned ESA.   



Interested persons may identify their interest and capability to respond to the requirement or submit proposals. This notice of intent is not a request for competitive proposals. However, all proposals received within forty-five days after date of publication of this synopsis will be considered by the Government. A determination by the Government not to compete with this proposed contract based upon responses to this notice is solely within the discretion of the Government. Information received will normally be considered solely for the purpose of determining whether to conduct a competitive procurement.



Based upon market research, the Government is not using the policies contained in Part 12, Acquisition of Commercial Items, in its solicitation for the described supplies. However, interested persons may identify to the contracting officer their interest and capability to satisfy the Government&#39;s requirement with a commercial item within 15 days of this notice.



This solicitation may include Procurement Note L09, Reverse Auction.  Since a reverse auction may be conducted, offerors are encouraged to access the Procurex system and review the reverse auction help tutorials at https//dla.procurexinc.com to learn more about how to participate in an auction.



In order to receive an award, regardless of dollar value, contractors must be registered in the System For Award Management (sam.gov). The final contract award decision may be based upon a combination of price, past performance and other evaluation factors as described in the solicitation. The estimated solicitation issue date is 08/20/2025.



A copy of the solicitation will be available via DIBBS at https://www.dibbs.bsm.dla.mil/ on the issue date cited in the RFP. Choose the RFP you wish to download. RFPs are in portable document format (PDF). To download and view these documents you will need the latest version of Adobe Acrobat Reader. This software is available free at http://www.adobe.com. A paper copy of this solicitation will not be available to requesters.


",DLA Aviation,2025-08-04 13:34:51.751000+00:00,2025-08-04,2025-09-22 19:00:00+00:00,2025-09-22,America/New_York,Presolicitation,SBA,336413,Other Aircraft Parts and Auxiliary Equipment Manufacturing ,1620,Aircraft Landing Gear Components,,CHRIS ROSE,CHRISTOPHER.ROSE@DLA.MIL,8042795920,,,Jeremy Prince,Jeremy.Prince@dla.mil,8042795994,,,,,,,,,,,,,,,,,,,97AS,SPE4A7,DLA AVIATION,bd87b14eebce4a20a47af476c662ca03,christopher.rose@dla.mil,christopher.rose@dla.mil,2025-08-04 13:34:51.756000+00:00,2025-08-04 13:33:31.837000+00:00,https://www.highergov.com/contract-opportunity/SPE4A725R0813-Presolicitation-2ca03,https://sam.gov/opp/bd87b14eebce4a20a47af476c662ca03/view
e281e0847a004a55a0c9c758a5f037ca,SPE4A724R0694,"PISTON, RETRACTABLE","Solicitation for End Item: F-16 Aircraft, Piston, Retractable, NSN: 1620-01-259-0557, 1000187169. TERM OF THE CONTRACT: 60 MONTHS. DELIVERY SCHEDULE 535 DAYS AFAA. Government FAT required.  Export Control and Configuration Control item. NAICS is 336413. This is a 100% small business set aside, full and open after exclusion of sources procurement, Potential sources:Goodrich Corp., CAGE 13002; Aerometals, Inc., CAGE 32664; Circor Aerospace, Inc., CAGE 50601; Canadian Commercial Corp., CAGE 98247; Machine Specialties, CAGE 1DDX0; Logistical Support, Inc., CAGE 1HFE7; Alro Machine Tool &amp; Dye, CAGE 1K556; Johnson Manufacturing, Inc., CAGE 1SJ80; Nassau Tool Works, CAGE 2M490; Fokker Landing Gear, CAGE H1632; Alta Precision, Inc., CAGE L1051. FOB Destination, Inspection/Acceptance: Origin. This is a request for proposal for an Indefinite Quantity Contract. Estimated Annual Quantities for the 5-year base period will be 20 each. Export Control drawings apply. Limited specifications, plans, or drawings relating to the procurement described are available and can be furnished by the Government. Request is for a written proposal, please submit offers to fax # (804) 279-4165. OFFERORS MUST COMPLETE A COPY OF THE SOLICITATION IN ORDER TO BE CONSIDERED FOR AWARD. The solicitation issue date is July 12, 2024. All responsible sources may submit an offer, which will be considered. Supplier Performance Risk System (SPRS) applies. The final contract award decision may be based upon a combination of price, past performance, and other evaluation factors as described in the solicitation.  POC: Renee Griffin; Email address: renee.griffin@dla.mil.
",DLA Aviation,2024-06-27 14:04:49.336000+00:00,2024-06-27,2024-08-12 19:00:00+00:00,2024-08-12,America/New_York,Presolicitation,SBA,336413,Other Aircraft Parts and Auxiliary Equipment Manufacturing ,1620,Aircraft Landing Gear Components,,Renee Griffin,Renee.Griffin@dla.mil,8042793379,,,,,,,,,,,,,,,,,,,,,,,,97AS,SPE4A7,DLA AVIATION,e281e0847a004a55a0c9c758a5f037ca,renee.griffin@dla.mil,renee.griffin@dla.mil,2024-08-28 03:55:45.381000+00:00,2024-06-27 13:54:12.104000+00:00,https://www.highergov.com/contract-opportunity/SPE4A724R0694-Presolicitation-037ca,https://sam.gov/opp/e281e0847a004a55a0c9c758a5f037ca/view
b9797e8b270a498dbd47a64e3211bfe1,SPE4A724R0342,"Title: 1620-014416911 / TRUNNION STRUT,LAND / AIRCRAFT, F-16","Solicitation for End Item: AIRCRAFT, F-16; Nomenclature: TRUNNION STRUT,LAND; NSN: 1620-014416911, THE REQUESTED DELIVERY SCHEDULE IS 277 DAYS PRODUCTION; Export Control does apply. Critical Application Item. The NSN is a NOT a Critical Safety Item (CSI). Configuration Control Applies. First Article Test requirements DO NOT apply to this NSN. Production Lot Test (PLT) requirements DO NOT apply to this NSN. NAICS is 336413. This is a Sole Source procurement with Full and Open Competition.



Source(s) of Supply listed in the Item Description:



CANADIAN COMMERCIAL CORP.          CAGE: 98247             P/N: 2006003-107

NASSAU TOOL WORKS, INC.                   CAGE: 2M490             P/N: 2006003-107

ISRAEL AEROSPACE INDUSTRIES          CAGE: 3252A             P/N: 2006003-107

ES3 PRIME LOGISTICS GROUP INC        CAGE: 4JZH8             P/N: 2006003-107

HDI LANDING GEAR USA INC                 CAGE: 5ZBP4             P/N: 2006003-107

GOODRICH CORPORATION                      CAGE: 6K4C8             P/N: 2006003-107

FOKKER LANDING GEAR B.V.                CAGE: H1632             P/N: 2006003-107

Alta Precision Inc                                           CAGE: L1051             P/N: 2006003-107

HEROUX-DEVTEK INC                              CAGE: 36164             P/N: 2006003-107

G. S. E. DYNAMICS, INC.                           CAGE: 29183             P/N: 2006003-107



FOB Destination, Inspection/Acceptance: Origin. This is a request for proposal for an Firm Fixed Contract. The quantity requested will be 8 each. Specifications, plans, or drawings relating to the procurement described may or may not be available and will be furnished by the Government through C-Folders if applicable. Request for a written proposal, please submit offers to Duran Campos, Sara via email at sara.durancampos@dla.mil OFFERORS MUST COMPLETE A COPY OF THE SOLICITATION IN ORDER TO BE CONSIDERED FOR AWARD.  A copy of the solicitation will be made available via DLA Internet Bid Board System at https://dibbs.bsm.dla.mil/ issue date cited in the RFP.  From the DIBBS Homepage, select Search RFPs.  Then choose the RFP you wish to download.  RFPs are in portable document format (pdf).  To download and view these documents you will need the lasted version of Adobe Acrobat Reader.  This software is available free at http://www.adobe.com.  A paper copy of this solicitation will not be available to requestors. 



The solicitation issue date will be on or about February 09, 2024.  All responsible sources may submit an offer, which will be considered.  PPIRS will be used to evaluate Past Performance.  Based upon market research, the Government is not using the policies contained in Part 15, Contracting by Negotiation, in its solicitation for the described supplies or services. However, interested persons may identify to the contracting officer their interest and capability to satisfy the Government&#39;s requirement with a commercial item within 15 days of this notice. The final contract award decision may be based upon a combination of price, past performance, and other evaluation factors as described in the solicitation. 
",DLA Aviation,2024-01-26 18:16:32.068000+00:00,2024-01-26,2024-02-09 20:00:00+00:00,2024-02-09,America/New_York,Presolicitation,SBA,336413,Other Aircraft Parts and Auxiliary Equipment Manufacturing ,1620,Aircraft Landing Gear Components,,"Duran Campos, Sara",sara.durancampos@dla.mil,8042792894,,,Holly Simmons,holly.simmons@dla.mil,8042792999,,,,Richmond,VA,23237,USA,UNITED STATES,,,,,,,,,,,97AS,SPE4A7,DLA AVIATION,b9797e8b270a498dbd47a64e3211bfe1,sara.durancampos@dla.mil,sara.durancampos@dla.mil,2024-02-25 04:55:47.693000+00:00,2024-01-26 18:12:35.048000+00:00,https://www.highergov.com/contract-opportunity/SPE4A724R0342-Presolicitation-1bfe1,https://sam.gov/opp/b9797e8b270a498dbd47a64e3211bfe1/view
2b3529f298d3413eb08e620a98938a63,SPE4A724R0342,"Title: 1620-014416911 / TRUNNION STRUT,LAND / AIRCRAFT, F-16","The DLA-Aviation is issuing this Sources Sought Synopsis as a means of conducting market research to identify parties having an interest in and the resources to support this requirement for a TRUNNION STRUT,LAND, NSN 1620-014416911. The result of this market research will contribute to determining the method of procurement. The applicable North American Industry Classification System (NAICS) code assigned to this procurement is 336413. 

THE SOLICITATION IS BEING POSTED ON SAM.GOV AT A LATER TIME. This request for capability information does not constitute a request for proposals; submission of any information in response to this market survey is purely voluntary; the government assumes no financial responsibility for any costs incurred.  

 
If your organization has the potential capacity to perform these contract services, please provide the following information: 1) Organization name, address, email address, Web site address, telephone number, and size and type of ownership for the organization; and 2) Tailored capability statements addressing the particulars of this effort, with appropriate documentation supporting claims of organizational and staff capability. If significant subcontracting or teaming is anticipated in order to deliver technical capability, organizations should address the administrative and management structure of such arrangements. 

The government will evaluate market information to ascertain potential market capacity to 1) provide services consistent in scope and scale with those described in this notice and otherwise anticipated; 2) secure and apply the full range of corporate financial, human capital, and technical resources required to successfully perform similar requirements; 3) implement a successful project management plan that includes: compliance with tight program schedules; cost containment; meeting and tracking performance; hiring and retention of key personnel and risk mitigation; and 4) provide services under a performance based service acquisition contract. 

BASED ON THE RESPONSES TO THIS SOURCES SOUGHT NOTICE/MARKET RESEARCH, THIS REQUIREMENT MAY BE SET-ASIDE FOR SMALL BUSINESSES OR PROCURED THROUGH FULL AND OPEN COMPETITION, and multiple awards MAY be made. Telephone inquiries will not be accepted or acknowledged, and no feedback or evaluations will be provided to companies regarding their submissions.

Submission Instructions: Interested parties who consider themselves qualified to perform the above-listed services are invited to submit a response to this Sources Sought Notice by February 02, 2024 NLT 03:00 p.m. All responses under this Sources Sought Notice must be emailed to sara.durancampos@dla.mil.

If you have any questions concerning this opportunity, please contact: sara.durancampos@dla.mil

 
APPENDIX 1: Purpose and Objectives 


Potential sources shall be capable of furnishing all labor, materials, facilities and equipment required to accomplish the new manufacture of the item(s).  Generally, this entails the procurement/manufacture of component parts, inspection, testing, preservation/packaging, and shipping.  Additionally, potential sources may be responsible for supply chain management, logistics planning, forecasting production requirements, long-lead time parts procurement, diminishing manufacturing sources and material shortage issues, and shipping serviceable assets. The unit prices will be established at the time of a contract award.

The specific requirement for this effort is below:

Part Number: 

CANADIAN COMMERCIAL CORP.    CAGE: 98247    P/N: 2006003-107
NASSAU TOOL WORKS, INC.         CAGE: 2M490     P/N: 2006003-107
ISRAEL AEROSPACE INDUSTRIES    CAGE: 3252A     P/N: 2006003-107
ES3 PRIME LOGISTICS GROUP INC     CAGE: 4JZH8     P/N: 2006003-107
HDI LANDING GEAR USA INC         CAGE: 5ZBP4     P/N: 2006003-107
GOODRICH CORPORATION         CAGE: 6K4C8     P/N: 2006003-107
FOKKER LANDING GEAR B.V.         CAGE: H1632     P/N: 2006003-107
Alta Precision Inc                 CAGE: L1051     P/N: 2006003-107
HEROUX-DEVTEK INC            CAGE: 36164    P/N: 2006003-107
G. S. E. DYNAMICS, INC.            CAGE: 29183    P/N: 2006003-107

Nomenclature: TRUNNION STRUT,LAND

NSN:  1620-01-441-6911

Estimated Annual Demand:  25 Each Estimated Annual Demand
 
",DLA Aviation,2024-01-26 17:38:46.671000+00:00,2024-01-26,2024-02-02 20:00:00+00:00,2024-02-02,America/New_York,Sources Sought,SBA,336413,Other Aircraft Parts and Auxiliary Equipment Manufacturing ,1620,Aircraft Landing Gear Components,,"Duran Campos, Sara",sara.durancampos@dla.mil,8042792894,,,Holly Simmons,holly.simmons@dla.mil,8042792999,,,,Richmond,VA,23237,USA,UNITED STATES,,,,,,,,,,,97AS,SPE4A7,DLA AVIATION,2b3529f298d3413eb08e620a98938a63,sara.durancampos@dla.mil,sara.durancampos@dla.mil,2024-02-18 04:55:47.706000+00:00,2024-01-26 17:34:59.662000+00:00,https://www.highergov.com/contract-opportunity/SPE4A724R0342-Sources_Sought-38a63,https://sam.gov/opp/2b3529f298d3413eb08e620a98938a63/view
