Notice ID,Solicitation ID,Solicitation Title,Description Text,Agency Name,Posted Timestamp,Posted Date,Response Timestamp,Response Deadline,Response Timezone,Opportunity Type,Set Aside Code,NAICS,NAICS Title,PSC,PSC Description,Primary Contact Title,Primary Contact Name,Primary Contact Email,Primary Contact Phone,Primary Contact Fax,Secondary Contact Title,Secondary Contact Name,Secondary Contact Email,Secondary Contact Phone,Secondary Contact Fax,Place of Performance Street Address,Place of Performance Street Address2,Place of Performance City,Place of Performance State,Place of Performance Zip,Place of Performance Country Code,Place of Performance Country,Related Opportunity Id,Award Date,Award Amount,Award Number,Delivery Order Number,Award Justification,Awardee Name,Awardee UEI,Awardee CAGE Code,Awardee Line Item,FPDS Code,FPDS Org ID,SAM Organization Name,Parent Opportunity ID,Modified By,Created By,Modified Timestamp,Created Timestamp,Site Page,Source Website
a977b933446e41d181acb30c63a12d50,80ARC025PA004,GE 90-94B Engine,"NASA ARC is hereby soliciting information from potential sources for of a General Electric GE90-94B engine. This engine, a high-bypass turbofan with a thrust rating of 94,000 pounds,

The National Aeronautics and Space Administration (NASA) ARC is seeking capability statements from all interested parties, including all socioeconomic categories of Small Businesses and Historically Black Colleges and Universities (HBCU)/Minority Institutions (MI) for the purposes of determining the appropriate level of competition and/or small business subcontracting goals for a GE90-94B Engine. The Government reserves the right to consider a Small, 8(a), Women-owned (WOSB), Service-Disabled Veteran (SD-VOSB), Economically Disadvantaged Women-owned Small Business (EDWOSB) or HUBZone business set-aside based on responses received.

No solicitation exists; therefore, do not request a copy of the solicitation. If a solicitation is released, it will be synopsized on SAM.gov. Interested firms are responsible for monitoring this website for the release of any solicitation or synopsis.

Vendors having the capabilities necessary to meet or exceed the stated requirements are invited to submit appropriate documentation, literature, brochures, and references.

All responses shall be submitted electronically via email to Joshua.D.Taggart@nasa.gov no later than March 31, 2025 at 5:00 CT p.m. Please reference 80ARC025PA004 in any response. 

This synopsis is for information and planning purposes only and is not to be construed as a commitment by the Government nor will the Government pay for information solicited. Respondents will not be notified of the results of the evaluation. Respondents deemed fully qualified will be considered in any resultant solicitation for the requirement. 
",Ames Research Center,2025-03-12 19:40:58.535000+00:00,2025-03-12,2025-03-31 22:00:00+00:00,2025-03-31,America/Chicago,Sources Sought,,336412,Aircraft Engine and Engine Parts Manufacturing ,2840,"Gas Turbines and Jet Engines, Aircraft, Prime Moving; and Components",,Joshua Taggart,joshua.d.taggart@nasa.gov,6506040790,,,,,,,,,Moffett Field,CA,,USA,UNITED STATES,,,,,,,,,,,8000,ARC00,NASA AMES RESEARCH CENTER,a977b933446e41d181acb30c63a12d50,joshua.d.taggart@nasa.gov,joshua.d.taggart@nasa.gov,2025-04-16 04:00:09.060000+00:00,2025-03-12 19:37:31.274000+00:00,https://www.highergov.com/contract-opportunity/80ARC025PA004-Sources_Sought-12d50,https://sam.gov/opp/a977b933446e41d181acb30c63a12d50/view
